Well_Id	Induction	Rel_Cell_Count	Compound_Id	Ref_Id	RefCpd_Id	Similarity	Induction_Ref	Conc_uM_Ref	Rel_Cell_Count_Ref	Trivial_Name_Ref	Known_Act_Ref	Chiral_Ref	Smiles_Ref
414802:01:03_10.00	9.2	94	414802	407872:02:04_06.00	407872	73.3	33.0	6.0	92	Erastin	a cell-permeable piperazinyl-quinazolinone compound that exhibits oncogene-selective lethality. Shown to bind mitochondrial voltage-dependent anion channels (VDAC) and alter its gating; rapidly induce an oxidative, non-apoptotic cell death in several human tumors harboring activating mutations in the RAS-RAF-MEK signaling (EC50 = 6.0 µM in BJ-TERT/LT/ST/RASV12 cells).; Yagoda, N., et al. 2007. Nature 447, 864.	False	CCOc1ccccc1-n1c(C(C)N2CCN(C(=O)COc3ccc(Cl)cc3)CC2)nc2ccccc2c1=O
414803:01:03_10.00	13.5	95	414803	407872:02:03_02.00	407872	82.1	13.5	2.0	100	Erastin	a cell-permeable piperazinyl-quinazolinone compound that exhibits oncogene-selective lethality. Shown to bind mitochondrial voltage-dependent anion channels (VDAC) and alter its gating; rapidly induce an oxidative, non-apoptotic cell death in several human tumors harboring activating mutations in the RAS-RAF-MEK signaling (EC50 = 6.0 µM in BJ-TERT/LT/ST/RASV12 cells).; Yagoda, N., et al. 2007. Nature 447, 864.	False	CCOc1ccccc1-n1c(C(C)N2CCN(C(=O)COc3ccc(Cl)cc3)CC2)nc2ccccc2c1=O
414803:01:03_10.00	13.5	95	414803	246498:01:04_30.00	246498	79.80000000000001	30.2	30.0	79	Mometasone furoate	Anti-inflammatory potency	False	C[C@@H]1C[C@H]2[C@@H]3CCC4=CC(=O)C=C[C@]4(C)[C@@]3(Cl)[C@@H](O)C[C@]2(C)[C@@]1(OC(=O)c1ccco1)C(=O)CCl
414803:01:03_10.00	13.5	95	414803	392756:02:03_02.00	392756	79.3	5.4	2.0	93	CGI-1746	CGI-1746 is a potent and highly selective inhibitor of the Btk with IC50 of 1.9 nM.	False	Cc1c(NC(=O)c2ccc(C(C)(C)C)cc2)cccc1-c1cn(C)c(=O)c(Nc2ccc(C(=O)N3CCOCC3)cc2)n1
414803:01:03_10.00	13.5	95	414803	246753:01:04_30.00	246753	78.5	9.8	30.0	91	Danazol	Danazol is a derivative of the synthetic steroid ethisterone, that suppresses the production of gonadotrophins, and has some weak androgenic effects.	True	C#C[C@]1(O)CC[C@H]2[C@@H]3CCC4=Cc5oncc5C[C@]4(C)[C@H]3CC[C@@]21C
414803:01:03_10.00	13.5	95	414803	280101:01:03_30.00	280101	77.9	7.9	30.0	92	Mephetyl tetrazole	potent and selective Kv1.5 potassium channel blocker.	False	COc1ccc(CCn2nnnc2C2(c3ccc(C)cc3)CC2)cc1
414803:01:03_10.00	13.5	95	414803	407872:02:04_06.00	407872	75.3	33.0	6.0	92	Erastin	a cell-permeable piperazinyl-quinazolinone compound that exhibits oncogene-selective lethality. Shown to bind mitochondrial voltage-dependent anion channels (VDAC) and alter its gating; rapidly induce an oxidative, non-apoptotic cell death in several human tumors harboring activating mutations in the RAS-RAF-MEK signaling (EC50 = 6.0 µM in BJ-TERT/LT/ST/RASV12 cells).; Yagoda, N., et al. 2007. Nature 447, 864.	False	CCOc1ccccc1-n1c(C(C)N2CCN(C(=O)COc3ccc(Cl)cc3)CC2)nc2ccccc2c1=O
414803:01:03_10.00	13.5	95	414803	245387:02:04_30.00	245387	75.3	15.9	30.0	104	Tolnaftate	Tolnaftate (NP-27) is a synthetic thiocarbamate used as an anti-fungal agent. .	False	Cc1cccc(N(C)C(=S)Oc2ccc3ccccc3c2)c1
414803:01:03_10.00	13.5	95	414803	410094:01:03_02.00	410094	75.2	20.9	2.0	92	Belumosudil	Belumosudil (KD025) is a selective inhibitor of ROCK2 with IC50s of 105 nM and 24 uM for ROCK2 and ROCK1, respectively. Anti-fibrotic properties.	False	CC(C)NC(=O)COc1cccc(-c2nc(Nc3ccc4[nH]ncc4c3)c3ccccc3n2)c1
414803:01:03_10.00	13.5	95	414803	247127:01:04_30.00	247127	74.8	11.4	30.0	85	Cyclosporin A	IL 2 synthesis inhibitor.	True	C/C=C/C[C@@H](C)[C@@H](O)[C@H]1C(=O)N[C@@H](CC)C(=O)N(C)CC(=O)N(C)[C@@H](CC(C)C)C(=O)N[C@@H](C(C)C)C(=O)N(C)[C@@H](CC(C)C)C(=O)N[C@@H](C)C(=O)N[C@H](C)C(=O)N(C)[C@@H](CC(C)C)C(=O)N(C)[C@@H](CC(C)C)C(=O)N(C)[C@@H](C(C)C)C(=O)N1C
414803:01:03_10.00	13.5	95	414803	407872:02:04_10.00	407872	74.2	29.9	10.0	95	Erastin	a cell-permeable piperazinyl-quinazolinone compound that exhibits oncogene-selective lethality. Shown to bind mitochondrial voltage-dependent anion channels (VDAC) and alter its gating; rapidly induce an oxidative, non-apoptotic cell death in several human tumors harboring activating mutations in the RAS-RAF-MEK signaling (EC50 = 6.0 µM in BJ-TERT/LT/ST/RASV12 cells).; Yagoda, N., et al. 2007. Nature 447, 864.	False	CCOc1ccccc1-n1c(C(C)N2CCN(C(=O)COc3ccc(Cl)cc3)CC2)nc2ccccc2c1=O
414805:01:03_10.00	8.8	97	414805	392736:02:03_02.00	392736	73.3	16.1	2.0	93	TAK-632	TAK-632 is a potent pan-RAF inhibitor with IC50 of 1.4, 2.4 and 8.3 nM for CRAF, BRAFV600E, BRAFWT, respectively.	False	N#Cc1c(Oc2ccc(F)c(NC(=O)Cc3cccc(C(F)(F)F)c3)c2)ccc2nc(NC(=O)C3CC3)sc12
414805:01:03_10.00	8.8	97	414805	413005:01:02_30.00	413005	71.8	18.3	30.0	99	BAM7	BAM7 is a direct and selective activator of proapoptotic BAX with an IC50 of 3.3 uM.	False	CCOc1ccccc1/N=N/c1c(C)nn(-c2nc(-c3ccccc3)cs2)c1O
414805:01:03_10.00	8.8	97	414805	280101:01:03_30.00	280101	71.3	7.9	30.0	92	Mephetyl tetrazole	potent and selective Kv1.5 potassium channel blocker.	False	COc1ccc(CCn2nnnc2C2(c3ccc(C)cc3)CC2)cc1
414805:01:03_10.00	8.8	97	414805	407872:02:04_10.00	407872	70.39999999999999	29.9	10.0	95	Erastin	a cell-permeable piperazinyl-quinazolinone compound that exhibits oncogene-selective lethality. Shown to bind mitochondrial voltage-dependent anion channels (VDAC) and alter its gating; rapidly induce an oxidative, non-apoptotic cell death in several human tumors harboring activating mutations in the RAS-RAF-MEK signaling (EC50 = 6.0 µM in BJ-TERT/LT/ST/RASV12 cells).; Yagoda, N., et al. 2007. Nature 447, 864.	False	CCOc1ccccc1-n1c(C(C)N2CCN(C(=O)COc3ccc(Cl)cc3)CC2)nc2ccccc2c1=O
414805:01:03_10.00	8.8	97	414805	407872:01:06_10.00	407872	69.19999999999999	22.3	10.0	104	Erastin	a cell-permeable piperazinyl-quinazolinone compound that exhibits oncogene-selective lethality. Shown to bind mitochondrial voltage-dependent anion channels (VDAC) and alter its gating; rapidly induce an oxidative, non-apoptotic cell death in several human tumors harboring activating mutations in the RAS-RAF-MEK signaling (EC50 = 6.0 µM in BJ-TERT/LT/ST/RASV12 cells).; Yagoda, N., et al. 2007. Nature 447, 864.	False	CCOc1ccccc1-n1c(C(C)N2CCN(C(=O)COc3ccc(Cl)cc3)CC2)nc2ccccc2c1=O
414805:01:03_10.00	8.8	97	414805	247296:01:04_30.00	247296	66.9	20.2	30.0	98	Clobetasol propionate	Glucocorticoid receptor (IC50 = 1.456 nM); Progesterone receptor (IC50 = 3.17 nM)	False	CCC(=O)O[C@]1(C(=O)CCl)[C@@H](C)C[C@H]2[C@@H]3CCC4=CC(=O)C=C[C@]4(C)[C@@]3(F)[C@@H](O)C[C@@]21C
414805:01:03_10.00	8.8	97	414805	407872:02:04_06.00	407872	65.9	33.0	6.0	92	Erastin	a cell-permeable piperazinyl-quinazolinone compound that exhibits oncogene-selective lethality. Shown to bind mitochondrial voltage-dependent anion channels (VDAC) and alter its gating; rapidly induce an oxidative, non-apoptotic cell death in several human tumors harboring activating mutations in the RAS-RAF-MEK signaling (EC50 = 6.0 µM in BJ-TERT/LT/ST/RASV12 cells).; Yagoda, N., et al. 2007. Nature 447, 864.	False	CCOc1ccccc1-n1c(C(C)N2CCN(C(=O)COc3ccc(Cl)cc3)CC2)nc2ccccc2c1=O
414805:01:03_10.00	8.8	97	414805	280629:01:03_30.00	280629	65.3	46.8	30.0	63	Indirubin-3'-oxime	protein kinase inhibitor; inhibits cyclin-dependent kinases (IC50 = 0.18 - 3.33 µM) and GSK-3ß (IC50 = 0.19 µM). Inhibits CDK5- and GSK-3ß-mediated tau phosphorylation, a process over-active in Alzheimer disease states. Also inhibits AMPK, LCK and SGK. Induces cell cycle arrest and inhibits cell proliferation.	False	O=C1Nc2ccccc2/C1=C1/Nc2ccccc2/C1=N\O
414808:01:03_10.00	26.1	92	414808	407872:02:03_02.00	407872	72.89999999999999	13.5	2.0	100	Erastin	a cell-permeable piperazinyl-quinazolinone compound that exhibits oncogene-selective lethality. Shown to bind mitochondrial voltage-dependent anion channels (VDAC) and alter its gating; rapidly induce an oxidative, non-apoptotic cell death in several human tumors harboring activating mutations in the RAS-RAF-MEK signaling (EC50 = 6.0 µM in BJ-TERT/LT/ST/RASV12 cells).; Yagoda, N., et al. 2007. Nature 447, 864.	False	CCOc1ccccc1-n1c(C(C)N2CCN(C(=O)COc3ccc(Cl)cc3)CC2)nc2ccccc2c1=O
414808:01:03_10.00	26.1	92	414808	413005:01:02_30.00	413005	72.0	18.3	30.0	99	BAM7	BAM7 is a direct and selective activator of proapoptotic BAX with an IC50 of 3.3 uM.	False	CCOc1ccccc1/N=N/c1c(C)nn(-c2nc(-c3ccccc3)cs2)c1O
414808:01:03_10.00	26.1	92	414808	392756:02:03_02.00	392756	67.60000000000001	5.4	2.0	93	CGI-1746	CGI-1746 is a potent and highly selective inhibitor of the Btk with IC50 of 1.9 nM.	False	Cc1c(NC(=O)c2ccc(C(C)(C)C)cc2)cccc1-c1cn(C)c(=O)c(Nc2ccc(C(=O)N3CCOCC3)cc2)n1
414808:01:03_10.00	26.1	92	414808	246498:01:04_30.00	246498	67.2	30.2	30.0	79	Mometasone furoate	Anti-inflammatory potency	False	C[C@@H]1C[C@H]2[C@@H]3CCC4=CC(=O)C=C[C@]4(C)[C@@]3(Cl)[C@@H](O)C[C@]2(C)[C@@]1(OC(=O)c1ccco1)C(=O)CCl
414808:01:03_10.00	26.1	92	414808	522774:02:04_10.00	522774	65.60000000000001	5.9	10.0	96	NS13001	NS13001 is a potent, selective, orally active allosteric positive modulator of SK channels (small conductance calcium-activated potassium channels). The EC50s are 1.8 and 0.14 uM for SK2 and SK3, respectively. NS13001 holds promise as a potential therapeutic agent for treatment of spinocerebellar ataxia type 2 (SCA2) and possibly other cerebellar ataxias.	False	Cc1cc(C)n(-c2nc(Nc3ccc(Cl)cc3)c3ncn(C)c3n2)n1
414812:01:03_10.00	5.4	105	414812	280127:01:04_30.00	280127	83.5	46.5	30.0	91	ABT-702 dihydrochloride	ABT-702 dihydrochloride is a potent adenosine kinase (AK) inhibitor (IC50=1.7 nM).	False	Nc1ncnc2nc(-c3ccc(N4CCOCC4)nc3)cc(-c3cccc(Br)c3)c12
414812:01:03_10.00	5.4	105	414812	413107:01:04_10.00	413107	82.19999999999999	14.2	10.0	106	Ibutamoren mesylate	Ibutamoren (Mesylate) is a potent, non-peptide Growth hormone secretagogue receptor (GHSR) agonist.	True	CC(C)(N)C(=O)N[C@H](COCc1ccccc1)C(=O)N1CCC2(CC1)CN(S(C)(=O)=O)c1ccccc12
414812:01:03_10.00	5.4	105	414812	246847:01:04_30.00	246847	81.8	24.7	30.0	91	Quetiapine	dopamine and serotonin receptors antagonist, antipsychotic: 5ht antagonist, dopamine antagonist, h1-antihistamine, alpha adrenergic blocker.	False	OCCOCCN1CCN(C2=Nc3ccccc3Sc3ccccc32)CC1
414812:01:03_10.00	5.4	105	414812	280670:01:03_30.00	280670	81.5	34.5	30.0	96	LY-367,265	inhibits serotonin reuptake, 5-HT2A serotonin receptor antagonist.	False	O=S1(=O)N(CCN2CC=C(c3c[nH]c4cc(F)ccc34)CC2)c2cccc3c2N1CCC3
414812:01:03_10.00	5.4	105	414812	280474:01:03_30.00	280474	81.2	31.8	30.0	92	Droperidol	D1, D2 dopamine receptor antagonist.	False	O=C(CCCN1C=CC(n2c(=O)[nH]c3ccccc32)CC1)c1ccc(F)cc1
414812:01:03_10.00	5.4	105	414812	246363:01:04_30.00	246363	81.0	26.9	30.0	99	Tracazolate hydrochloride	GABA receptor modulator.	False	CCCCNc1c(C(=O)OCC)c(C)nc2c1cnn2CC
414812:01:03_10.00	5.4	105	414812	247095:02:03_30.00	247095	80.7	36.3	30.0	101	Nicardipine hydrochloride, YC-93 hydrochloride	L-type Ca2+ channel antagonist, antihypertensive, vasodilator.	False	COC(=O)C1=C(C)NC(C)=C(C(=O)OCCN(C)Cc2ccccc2)C1c1cccc([N+](=O)[O-])c1
414812:01:03_10.00	5.4	105	414812	246859:01:04_30.00	246859	80.30000000000001	34.2	30.0	108	Vardenafil	PDE5 inhibitor.	False	CCCc1nc(C)c2c(=O)nc(-c3cc(S(=O)(=O)N4CCN(CC)CC4)ccc3OCC)[nH]n12
414812:01:03_10.00	5.4	105	414812	246445:01:04_10.00	246445	80.2	8.1	10.0	101	Ketanserin tartrate hydrate	5-HT2 antagonist.	False	O=C(c1ccc(F)cc1)C1CCN(CCn2c(=O)[nH]c3ccccc3c2=O)CC1
414812:01:03_10.00	5.4	105	414812	247042:01:04_30.00	247042	79.9	32.0	30.0	89	Pimozide	Ca2+ channel antagonist, antipsychotic, D2 dopamine receptor antagonist, Dopamine antagonist ?.	False	O=c1[nH]c2ccccc2n1C1CCN(CCCC(c2ccc(F)cc2)c2ccc(F)cc2)CC1
414839:01:03_10.00	33.3	99	414839	247296:01:04_30.00	247296	73.9	20.2	30.0	98	Clobetasol propionate	Glucocorticoid receptor (IC50 = 1.456 nM); Progesterone receptor (IC50 = 3.17 nM)	False	CCC(=O)O[C@]1(C(=O)CCl)[C@@H](C)C[C@H]2[C@@H]3CCC4=CC(=O)C=C[C@]4(C)[C@@]3(F)[C@@H](O)C[C@@]21C
414839:01:03_10.00	33.3	99	414839	280101:01:03_30.00	280101	71.2	7.9	30.0	92	Mephetyl tetrazole	potent and selective Kv1.5 potassium channel blocker.	False	COc1ccc(CCn2nnnc2C2(c3ccc(C)cc3)CC2)cc1
414839:01:03_10.00	33.3	99	414839	407872:02:04_10.00	407872	71.1	29.9	10.0	95	Erastin	a cell-permeable piperazinyl-quinazolinone compound that exhibits oncogene-selective lethality. Shown to bind mitochondrial voltage-dependent anion channels (VDAC) and alter its gating; rapidly induce an oxidative, non-apoptotic cell death in several human tumors harboring activating mutations in the RAS-RAF-MEK signaling (EC50 = 6.0 µM in BJ-TERT/LT/ST/RASV12 cells).; Yagoda, N., et al. 2007. Nature 447, 864.	False	CCOc1ccccc1-n1c(C(C)N2CCN(C(=O)COc3ccc(Cl)cc3)CC2)nc2ccccc2c1=O
414839:01:03_10.00	33.3	99	414839	392756:02:04_06.00	392756	70.6	29.4	6.0	95	CGI-1746	CGI-1746 is a potent and highly selective inhibitor of the Btk with IC50 of 1.9 nM.	False	Cc1c(NC(=O)c2ccc(C(C)(C)C)cc2)cccc1-c1cn(C)c(=O)c(Nc2ccc(C(=O)N3CCOCC3)cc2)n1
414839:01:03_10.00	33.3	99	414839	280629:01:03_30.00	280629	70.5	46.8	30.0	63	Indirubin-3'-oxime	protein kinase inhibitor; inhibits cyclin-dependent kinases (IC50 = 0.18 - 3.33 µM) and GSK-3ß (IC50 = 0.19 µM). Inhibits CDK5- and GSK-3ß-mediated tau phosphorylation, a process over-active in Alzheimer disease states. Also inhibits AMPK, LCK and SGK. Induces cell cycle arrest and inhibits cell proliferation.	False	O=C1Nc2ccccc2/C1=C1/Nc2ccccc2/C1=N\O
414839:01:03_10.00	33.3	99	414839	410511:01:03_30.00	410511	69.5	34.2	30.0	88		negative control of BI-1942.	True	CC[C@@H](C(=O)OC)n1c(=O)c2ccccc2n(Cc2cn(C)c3cccc(C)c23)c1=O
414839:01:03_10.00	33.3	99	414839	392756:02:04_10.00	392756	68.10000000000001	29.5	10.0	89	CGI-1746	CGI-1746 is a potent and highly selective inhibitor of the Btk with IC50 of 1.9 nM.	False	Cc1c(NC(=O)c2ccc(C(C)(C)C)cc2)cccc1-c1cn(C)c(=O)c(Nc2ccc(C(=O)N3CCOCC3)cc2)n1
414839:01:03_10.00	33.3	99	414839	413013:01:03_30.00	413013	67.7	12.6	30.0	93	IWP L6	IWP L6 (PorcnInhibitorIII) is a Porcn inhibitor with an EC50 of 0.5 nM.	False	O=C(CSc1nc2c(c(=O)n1-c1ccccc1)SCC2)Nc1ccc(-c2ccccc2)cn1
414839:01:03_10.00	33.3	99	414839	407872:02:04_06.00	407872	67.30000000000001	33.0	6.0	92	Erastin	a cell-permeable piperazinyl-quinazolinone compound that exhibits oncogene-selective lethality. Shown to bind mitochondrial voltage-dependent anion channels (VDAC) and alter its gating; rapidly induce an oxidative, non-apoptotic cell death in several human tumors harboring activating mutations in the RAS-RAF-MEK signaling (EC50 = 6.0 µM in BJ-TERT/LT/ST/RASV12 cells).; Yagoda, N., et al. 2007. Nature 447, 864.	False	CCOc1ccccc1-n1c(C(C)N2CCN(C(=O)COc3ccc(Cl)cc3)CC2)nc2ccccc2c1=O
414839:01:03_10.00	33.3	99	414839	407872:01:06_10.00	407872	66.7	22.3	10.0	104	Erastin	a cell-permeable piperazinyl-quinazolinone compound that exhibits oncogene-selective lethality. Shown to bind mitochondrial voltage-dependent anion channels (VDAC) and alter its gating; rapidly induce an oxidative, non-apoptotic cell death in several human tumors harboring activating mutations in the RAS-RAF-MEK signaling (EC50 = 6.0 µM in BJ-TERT/LT/ST/RASV12 cells).; Yagoda, N., et al. 2007. Nature 447, 864.	False	CCOc1ccccc1-n1c(C(C)N2CCN(C(=O)COc3ccc(Cl)cc3)CC2)nc2ccccc2c1=O
414864:01:03_10.00	5.0	108	414864	519808:01:04_30.00	519808	84.5	57.5	30.0	96		BI-1046 has been identified as a potent and selective GPR142 agonist which increases Gq-coupled signalling in cells of recombinant and endogenous receptor expression. BI-1046 displays high potency with an EC50 of 0.05 nM in an IP1-based cellular assay. The GPR142 agonistic activity of BI-1046 has been demonstrated to potentiate glucose-stimulated insulin secretion from mouse islets, a physiological response that translates into improved glucose tolerance in mice when investigated in an acute oral glucose tolerance test.	False	Cn1cncc1-c1cn(-c2cccc(C(=O)Nc3cccc(C(F)(F)F)c3)c2)nn1
414864:01:03_10.00	5.0	108	414864	520969:01:04_50.00	520969	82.8	72.9	50.0	95	ML241 (hydrochloride)	ML241 hydrochloride is a potent p97 inhibitor, inhibiting p97 ATPase with IC50 value of 100 nM.	False	c1ccc(CNc2nc(N3CCOc4ccccc43)nc3c2CCCC3)cc1
414864:01:03_10.00	5.0	108	414864	246811:02:03_30.00	246811	82.5	43.5	30.0	89	Bromocryptine mesylate	prolactin inhibitor.	True	CC(C)C[C@H]1C(=O)N2CCC[C@H]2[C@]2(O)O[C@](NC(=O)[C@@H]3C=C4c5cccc6[nH]c(Br)c(c56)C[C@H]4N(C)C3)(C(C)C)C(=O)N12
414864:01:03_10.00	5.0	108	414864	246811:02:03_50.00	246811	82.0	44.6	50.0	92	Bromocryptine mesylate	prolactin inhibitor.	True	CC(C)C[C@H]1C(=O)N2CCC[C@H]2[C@]2(O)O[C@](NC(=O)[C@@H]3C=C4c5cccc6[nH]c(Br)c(c56)C[C@H]4N(C)C3)(C(C)C)C(=O)N12
414864:01:03_10.00	5.0	108	414864	280500:01:03_10.00	280500	81.6	14.3	10.0	100	N-Methyldopamine hydrochloride, Epinine hydrochloride	dopamine receptor agonist.	False	CNCCc1ccc(O)c(O)c1
414864:01:03_10.00	5.0	108	414864	280086:01:03_10.00	280086	81.39999999999999	44.0	10.0	98	Lercanidipine hydrochloride hemihydrate	L-type (Cav1.2b) vascular calcium channel antagonist.	False	COC(=O)C1=C(C)NC(C)=C(C(=O)OC(C)(C)CN(C)CCC(c2ccccc2)c2ccccc2)C1c1cccc([N+](=O)[O-])c1
414864:01:03_10.00	5.0	108	414864	413032:01:03_50.00	413032	81.10000000000001	38.2	50.0	100	NS309	NS309 is a potent and selective opener of the small or intermediate conductance Ca2+-activated K+ (SK or IK, respectively) channels, but displays no activity at BK channels.	False	O=Nc1c(O)[nH]c2c(Cl)c(Cl)ccc12
414864:01:03_10.00	5.0	108	414864	528532:01:02_05.00	528532	81.0	6.4	5.0	104		negative control to SGC-CK2-1	False	Cc1ccc(N(C)c2cc(NC3CC3)n3ncc(C#N)c3n2)cc1N(C)C(=O)C1CC1
414864:01:03_10.00	5.0	108	414864	247099:02:03_10.00	247099	81.0	12.3	10.0	98	Carbetapentane (citrate)	Carbetapentane citrate is a selective inhibitor of the cough, with mild atropine-like effect and local anesthesia effect.	False	CCN(CC)CCOCCOC(=O)C1(c2ccccc2)CCCC1
414864:01:03_10.00	5.0	108	414864	246414:01:04_10.00	246414	80.7	76.2	10.0	94	Fendiline (hydrochloride)	Fendiline hydrochloride is a nonselective calcium channel blocker.	False	CC(NCCC(c1ccccc1)c1ccccc1)c1ccccc1
414904:01:03_10.00	24.5	100	414904	246866:02:03_10.00	246866	84.3	27.8	10.0	94	Cilnidipine	slow-acting Ca2+ channel blocker, antihypertensive, vasodilator. Does not inhibit PKC.	False	COCCOC(=O)C1=C(C)NC(C)=C(C(=O)OC/C=C/c2ccccc2)C1c1cccc([N+](=O)[O-])c1
414904:01:03_10.00	24.5	100	414904	528526:01:02_05.00	528526	84.0	11.9	5.0	109		NR162 is a potent and selective CASK (Ca2+/calmodulin-dependent Ser/Thr kinase) inhibitor with a Kd of 22 nM in ITC and IC50 of 80 nM in NanoBRET assay.	False	Cc1cc(Br)c(CNc2ncc(C(=O)NCCCN3CCOC3=O)c(NC3CCCC3)n2)cc1Br
414904:01:03_10.00	24.5	100	414904	522774:02:04_50.00	522774	83.6	29.5	50.0	101	NS13001	NS13001 is a potent, selective, orally active allosteric positive modulator of SK channels (small conductance calcium-activated potassium channels). The EC50s are 1.8 and 0.14 uM for SK2 and SK3, respectively. NS13001 holds promise as a potential therapeutic agent for treatment of spinocerebellar ataxia type 2 (SCA2) and possibly other cerebellar ataxias.	False	Cc1cc(C)n(-c2nc(Nc3ccc(Cl)cc3)c3ncn(C)c3n2)n1
414904:01:03_10.00	24.5	100	414904	409837:01:03_10.00	409837	83.39999999999999	13.1	10.0	97	GSK-5959	GSK-5959 is a potent, selective and cell permeable BRPF1 bromodomain inhibitor with an IC50 of ~ 80 nM.	False	COc1ccccc1C(=O)Nc1cc2c(cc1N1CCCCC1)n(C)c(=O)n2C
414904:01:03_10.00	24.5	100	414904	413167:01:02_03.00	413167	83.3	16.4	3.0	102		negative control to BI-1950	True	C[C@@]1(Cc2ccc(C#N)cc2)C(=O)N(c2cc(Cl)cc(Cl)c2)c2ncc(C(=O)NC3(c4nc(C5CCC5)no4)CC3)n21
414904:01:03_10.00	24.5	100	414904	522774:02:04_30.00	522774	82.19999999999999	23.0	30.0	92	NS13001	NS13001 is a potent, selective, orally active allosteric positive modulator of SK channels (small conductance calcium-activated potassium channels). The EC50s are 1.8 and 0.14 uM for SK2 and SK3, respectively. NS13001 holds promise as a potential therapeutic agent for treatment of spinocerebellar ataxia type 2 (SCA2) and possibly other cerebellar ataxias.	False	Cc1cc(C)n(-c2nc(Nc3ccc(Cl)cc3)c3ncn(C)c3n2)n1
414904:01:03_10.00	24.5	100	414904	101009:01:19_30.00	101009	81.8	30.9	30.0	89	Centrocountin 1	modulator of centrosome integrity; binds centrosome-associated proteins nucleophosmin (NPM) and Crm1.; Nat. Chem. Biol. 2012, 8, 179	True	COC(=O)C1=CC(C(=O)c2ccccc2O)=CN2CCc3c([nH]c4ccccc34)[C@]12C(=O)OC
414904:01:03_10.00	24.5	100	414904	407974:01:04_10.00	407974	80.9	19.2	10.0	97	GSK8814	it is a chemical probe for the ATAD2/2B bromodomain, with a binding constant pKd=8.1 as measured by ITC (Bamborough et al, 2016). GSK8814 displaces acetylated H4 peptide from the ATAD2 bromodomain with pIC50 =7.3 and is also active in BROMOscan with pKi=8.9. It is more than 100 fold selective over all other bromodomains in the BROMOscan. Importantly, it is more than 1000 fold selective over BRD4. GSK8814 shows cellular target engagement with an EC50 of 2 µM in a NanoBRET assay evaluating the interaction of the NanoLuc-ATAD2 bromodomain with histone H3.3-HaloTag.	True	CO[C@H]1CNC[C@@H](OCC2CCC(F)(F)CC2)[C@@H]1Nc1ncc(-c2cncc(C)c2)c2cc(C)c(=O)[nH]c12
414904:01:03_10.00	24.5	100	414904	522774:02:04_10.00	522774	80.5	5.9	10.0	96	NS13001	NS13001 is a potent, selective, orally active allosteric positive modulator of SK channels (small conductance calcium-activated potassium channels). The EC50s are 1.8 and 0.14 uM for SK2 and SK3, respectively. NS13001 holds promise as a potential therapeutic agent for treatment of spinocerebellar ataxia type 2 (SCA2) and possibly other cerebellar ataxias.	False	Cc1cc(C)n(-c2nc(Nc3ccc(Cl)cc3)c3ncn(C)c3n2)n1
414904:01:03_10.00	24.5	100	414904	408877:01:04_50.00	408877	80.4	29.7	50.0	91	Acid Ceramidase Inhibitor 17a, ;ARN14974	it is a benzoxazolone carboxamide that potently inhibits acid ceramidase (IC50 = 79 nM). This effect is persistent, as it inhibits acid ceramidase activity in cells for up to 24 hours. ARN14974 is extremely stable in buffers and plasma and shows good pharmacokinetics when administered intravenously or intraperitoneally in mice. It causes a significant reduction in acid ceramidase activity in multiple organs in mice, including brain, liver, heart, lungs, and kidney.	False	O=C(NCCCCc1ccccc1)n1c(=O)oc2cc(-c3ccc(F)cc3)ccc21
414970:01:03_10.00	11.4	102	414970	280732:01:03_30.00	280732	89.0	49.1	30.0	97	Gallopamil (hydrochloride)	Gallopamil hydrochloride (Methoxyverapamil hydrochloride), a methoxy derivative of Verapamil, is a phenylalkylamine calcium antagonist. Gallopamil hydrochloride inhibits acid secretion in a concentration-dependent manner with an IC50 of 10.9 uM. Gallopamil hydrochloride is a potent antiarrhythmic and vasodilator agent.	False	COc1ccc(CCN(C)CCCC(C#N)(c2cc(OC)c(OC)c(OC)c2)C(C)C)cc1OC
414970:01:03_10.00	11.4	102	414970	246742:01:04_30.00	246742	88.2	24.4	30.0	101	Amoxapine	Amoxapine is a tetracyclic antidepressant of the dibenzoxazepine family, though it is often classified as a secondary amine tricyclic antidepressant.	False	Clc1ccc2c(c1)C(N1CCNCC1)=Nc1ccccc1O2
414970:01:03_10.00	11.4	102	414970	280902:01:03_30.00	280902	88.1	43.2	30.0	103	Ketanserin tartrate, R 41468	selective 5-HT2 serotonin receptor blocker.	False	O=C(c1ccc(F)cc1)C1CCN(CCn2c(=O)[nH]c3ccccc3c2=O)CC1
414970:01:03_10.00	11.4	102	414970	287906:02:09_10.00	287906	88.0	38.3	10.0	98	Pipinib	Hedgehog pathway Inhibitor; targets PI4KIIIß.	False	COC(=O)c1ccc(Nc2nc(NC(C)C)nc3ccsc23)cc1
414970:01:03_10.00	11.4	102	414970	413171:01:02_03.00	413171	87.8	37.5	3.0	107		negative control to GSM1	True	COc1cc(-c2cn([C@H]3CCc4ccccc4N(CC(F)(F)F)C3=O)nn2)ccc1-n1ccc(C)n1
414970:01:03_10.00	11.4	102	414970	280483:01:03_30.00	280483	87.3	49.2	30.0	100	Dihydroergotamine methanesulfonate	ergot alkaloid, vasoconstrictor, competitive serotonin receptor antagonist, partial agonist at alpha adrenoceptors and D2 dopamine receptors, vasoconstrictor, antimigraine.	False	CN1C[C@H](C(=O)N[C@]2(C)O[C@@]3(O)[C@@H]4CCCN4C(=O)[C@H](Cc4ccccc4)N3C2=O)C[C@@H]2c3cccc4[nH]cc(c34)C[C@H]21
414970:01:03_10.00	11.4	102	414970	247233:01:04_30.00	247233	87.1	24.0	30.0	98	Citalopram (hydrobromide)	Citalopram hydrobromide is an antidepressant drug of the selective serotonin reuptake inhibitor (SSRI) class. It has US FDA approval to treat major depression.	False	CN(C)CCCC1(c2ccc(F)cc2)OCc2cc(C#N)ccc21
414970:01:03_10.00	11.4	102	414970	246877:02:03_30.00	246877	87.0	57.7	30.0	103	(±)-Verapamil hydrochloride	L-type Ca2+ channel modulator, adrenoceptor antagonist, antiarryhthmic, cardiac depressant, coronary vasodilator, Alpha1 antagonist, adrenegic blocker, ca channel blocker, coronary vasodilator, antiarrhythmic.	False	COc1ccc(CCN(C)CCCC(C#N)(c2ccc(OC)c(OC)c2)C(C)C)cc1OC
414970:01:03_10.00	11.4	102	414970	246445:01:04_30.00	246445	86.8	29.5	30.0	100	Ketanserin tartrate hydrate	5-HT2 antagonist.	False	O=C(c1ccc(F)cc1)C1CCN(CCn2c(=O)[nH]c3ccccc3c2=O)CC1
414970:01:03_10.00	11.4	102	414970	280282:01:03_30.00	280282	86.7	48.4	30.0	92	Amperozide hydrochloride	atypical antipsychotic drug with high affinity for serotonin receptors and low affinity for D2 dopamine receptors.	False	CCNC(=O)N1CCN(CCCC(c2ccc(F)cc2)c2ccc(F)cc2)CC1
414998:01:03_10.00	11.6	96	414998	409343:02:02_03.00	409343	83.1	57.2	3.0	92	BAY-309,control for BAY-826	negative control to BAY-826	False	Cc1cc(NC(=O)c2cccc(S(F)(F)(F)(F)F)c2)cc(-n2ccn3nc(-c4cccnc4)cc23)c1
414998:01:03_10.00	11.6	96	414998	246456:01:04_10.00	246456	82.6	35.8	10.0	97	Cisapride	5-HT antagonist.	False	COc1cc(N)c(Cl)cc1C(=O)N[C@H]1CCN(CCCOc2ccc(F)cc2)C[C@H]1OC
414998:01:03_10.00	11.6	96	414998	247197:01:04_10.00	247197	81.6	30.4	10.0	102	Oxethazaine	Oxethazaine (Oxetacaine), a precursor of phentermineacidic,  is an acid-resistent and orally active analgesic agent. Oxethazaine (Oxetacaine) has the potential for the relief of pain associated withpeptic ulcer diseaseoresophagitis.	False	CN(C(=O)CN(CCO)CC(=O)N(C)C(C)(C)Cc1ccccc1)C(C)(C)Cc1ccccc1
