Well_Id	Induction	Rel_Cell_Count	Compound_Id	Ref_Id	RefCpd_Id	Similarity	Induction_Ref	Conc_uM_Ref	Rel_Cell_Count_Ref	Trivial_Name_Ref	Known_Act_Ref	Chiral_Ref	Smiles_Ref
417413:01:03_10.00	11.6	108	417413	407970:01:03_10.00	407970	85.0	31.4	10.0	106	A-395	A-395 is an antagonist of polycomb repressive complex 2 (PRC2) protein-protein interactions that potently inhibits the trimeric PRC2 complex (EZH2-EED-SUZ12) with an IC50 of 18 nM.	True	CN(C)[C@H]1CN(C2CCc3cccc(F)c32)C[C@@H]1c1ccc(N2CCN(S(C)(=O)=O)CC2)cc1
417531:01:03_10.00	6.6	98	417531	392290:03:03_30.00	392290	75.2	26.3	30.0	91	GSK2606414	GSK2606414 is a cell-permeable and orally available protein kinase R-like endoplasmic reticulum (ER) kinase (PERK) inhibitor with an IC50 of 0.4 nM.; Discovery of 7-Methyl-5-(1-{[3-(trifluoromethyl)phenyl]acetyl}-2,3-dihydro-1H-indol-5-yl)-7H-pyrrolo[2,3-d]pyrimidin-4-amine (GSK2606414), a Potent and Selective First-in-Class Inhibitor of Protein Kinase R (PKR)-like Endoplasmic Reticulum Kinase (PERK) J. Med. Chem. 2012	False	Cn1cc(-c2ccc3c(c2)CCN3C(=O)Cc2cccc(C(F)(F)F)c2)c2c(N)ncnc21
417531:01:03_10.00	6.6	98	417531	392290:03:03_50.00	392290	72.7	28.0	50.0	98	GSK2606414	GSK2606414 is a cell-permeable and orally available protein kinase R-like endoplasmic reticulum (ER) kinase (PERK) inhibitor with an IC50 of 0.4 nM.; Discovery of 7-Methyl-5-(1-{[3-(trifluoromethyl)phenyl]acetyl}-2,3-dihydro-1H-indol-5-yl)-7H-pyrrolo[2,3-d]pyrimidin-4-amine (GSK2606414), a Potent and Selective First-in-Class Inhibitor of Protein Kinase R (PKR)-like Endoplasmic Reticulum Kinase (PERK) J. Med. Chem. 2012	False	Cn1cc(-c2ccc3c(c2)CCN3C(=O)Cc2cccc(C(F)(F)F)c2)c2c(N)ncnc21
417531:01:03_10.00	6.6	98	417531	413196:01:02_05.00	528551	72.6	6.0	5.0	99		An inhibitor of Complex I quinone binding site (core subunit of the mitochondrial membrane respiratory chain NADH dehydrogenase). Active in cellular mechanistic assay demonstrating cellular target engagement. Proliferation assays: IC50 = 79 nM (H1299 (human lung); IC50 = 33 nM (H1299 (human lung). Negative control = BAY-070	False	c1ccc2oc(-c3csc(C4CCN(Cc5nc6cccnc6[nH]5)CC4)n3)cc2c1
417531:01:03_10.00	6.6	98	417531	392290:03:03_10.00	392290	71.1	14.2	10.0	94	GSK2606414	GSK2606414 is a cell-permeable and orally available protein kinase R-like endoplasmic reticulum (ER) kinase (PERK) inhibitor with an IC50 of 0.4 nM.; Discovery of 7-Methyl-5-(1-{[3-(trifluoromethyl)phenyl]acetyl}-2,3-dihydro-1H-indol-5-yl)-7H-pyrrolo[2,3-d]pyrimidin-4-amine (GSK2606414), a Potent and Selective First-in-Class Inhibitor of Protein Kinase R (PKR)-like Endoplasmic Reticulum Kinase (PERK) J. Med. Chem. 2012	False	Cn1cc(-c2ccc3c(c2)CCN3C(=O)Cc2cccc(C(F)(F)F)c2)c2c(N)ncnc21
417531:01:03_10.00	6.6	98	417531	412994:01:03_10.00	412994	70.5	30.9	10.0	95	Lonafarnib	Lonafarnib is an orally bioavailable farnesyl protein transferase (FPTase) inhibitor for H-ras, K-ras and N-ras with IC50 of 1.9 nM, 5.2 nM and 2.8 nM, respectively. Lonafarnib has anti-hepatitis delta virus (HDV) activities.	True	NC(=O)N1CCC(CC(=O)N2CCC([C@H]3c4ncc(Br)cc4CCc4cc(Cl)cc(Br)c43)CC2)CC1
417531:01:03_10.00	6.6	98	417531	412994:01:03_06.00	412994	65.8	22.6	6.0	90	Lonafarnib	Lonafarnib is an orally bioavailable farnesyl protein transferase (FPTase) inhibitor for H-ras, K-ras and N-ras with IC50 of 1.9 nM, 5.2 nM and 2.8 nM, respectively. Lonafarnib has anti-hepatitis delta virus (HDV) activities.	True	NC(=O)N1CCC(CC(=O)N2CCC([C@H]3c4ncc(Br)cc4CCc4cc(Cl)cc(Br)c43)CC2)CC1
417571:01:03_10.00	15.0	104	417571	246811:02:03_50.00	246811	87.4	44.6	50.0	92	Bromocryptine mesylate	prolactin inhibitor.	True	CC(C)C[C@H]1C(=O)N2CCC[C@H]2[C@]2(O)O[C@](NC(=O)[C@@H]3C=C4c5cccc6[nH]c(Br)c(c56)C[C@H]4N(C)C3)(C(C)C)C(=O)N12
417571:01:03_10.00	15.0	104	417571	280086:01:03_10.00	280086	86.6	44.0	10.0	98	Lercanidipine hydrochloride hemihydrate	L-type (Cav1.2b) vascular calcium channel antagonist.	False	COC(=O)C1=C(C)NC(C)=C(C(=O)OC(C)(C)CN(C)CCC(c2ccccc2)c2ccccc2)C1c1cccc([N+](=O)[O-])c1
417571:01:03_10.00	15.0	104	417571	246811:02:03_30.00	246811	85.9	43.5	30.0	89	Bromocryptine mesylate	prolactin inhibitor.	True	CC(C)C[C@H]1C(=O)N2CCC[C@H]2[C@]2(O)O[C@](NC(=O)[C@@H]3C=C4c5cccc6[nH]c(Br)c(c56)C[C@H]4N(C)C3)(C(C)C)C(=O)N12
417571:01:03_10.00	15.0	104	417571	246820:12:03_50.00	246820	85.6	39.6	50.0	91	Bifonazole	antifungal, calmodulin antagonist.	False	c1ccc(-c2ccc(C(c3ccccc3)n3ccnc3)cc2)cc1
417571:01:03_10.00	15.0	104	417571	413221:01:03_10.00	413221	83.6	29.2	10.0	104	Conivaptan (hydrochloride)	Conivaptan (hydrochloride) is a non-peptide antagonist of vasopressin receptor, with Ki values of 0.48 and 3.04 nM for rat liver V1A receptor and rat kidney V2 receptor respectively.	False	Cc1nc2c([nH]1)-c1ccccc1N(C(=O)c1ccc(NC(=O)c3ccccc3-c3ccccc3)cc1)CC2
417571:01:03_10.00	15.0	104	417571	413085:01:07_03.00	413085	83.39999999999999	29.4	3.0	91	NVS-PAK1-1	NVS-PAK1-1 is a potent and selective allosteric PAK1 inhibitor with an IC50 of 5 nM.	True	CC(C)NC(=O)N1CC[C@H](NC2=Nc3cc(F)ccc3N(CC(F)F)c3ccc(Cl)cc32)C1
417571:01:03_10.00	15.0	104	417571	382150:02:04_50.00	382150	83.3	29.5	50.0	98	GW788388	selective inhibitor of TGF-ßRI.	False	O=C(NC1CCOCC1)c1ccc(-c2cc(-c3c[nH]nc3-c3ccccn3)ccn2)cc1
417571:01:03_10.00	15.0	104	417571	519808:01:04_30.00	519808	83.2	57.5	30.0	96		BI-1046 has been identified as a potent and selective GPR142 agonist which increases Gq-coupled signalling in cells of recombinant and endogenous receptor expression. BI-1046 displays high potency with an EC50 of 0.05 nM in an IP1-based cellular assay. The GPR142 agonistic activity of BI-1046 has been demonstrated to potentiate glucose-stimulated insulin secretion from mouse islets, a physiological response that translates into improved glucose tolerance in mice when investigated in an acute oral glucose tolerance test.	False	Cn1cncc1-c1cn(-c2cccc(C(=O)Nc3cccc(C(F)(F)F)c3)c2)nn1
417571:01:03_10.00	15.0	104	417571	520969:01:04_50.00	520969	82.8	72.9	50.0	95	ML241 (hydrochloride)	ML241 hydrochloride is a potent p97 inhibitor, inhibiting p97 ATPase with IC50 value of 100 nM.	False	c1ccc(CNc2nc(N3CCOc4ccccc43)nc3c2CCCC3)cc1
417571:01:03_10.00	15.0	104	417571	413171:01:02_03.00	413171	82.69999999999999	37.5	3.0	107		negative control to GSM1	True	COc1cc(-c2cn([C@H]3CCc4ccccc4N(CC(F)(F)F)C3=O)nn2)ccc1-n1ccc(C)n1
417572:01:03_10.00	8.1	100	417572	280360:01:03_10.00	280360	78.5	19.3	10.0	105	CGS-12066A maleate	5-HT1B Serotonin receptor agonist.	False	CN1CCN(c2nc3cc(C(F)(F)F)ccc3n3cccc23)CC1
417572:01:03_10.00	8.1	100	417572	528559:01:02_03.00	528559	77.9	10.9	3.0	95		GSK973 is a BD2 selective inhibitor of BRD2, BRD3, BRD4 and BRDT. BRD2 (BD2) pIC50 = 7.5; BRD3 (BD2) pIC50 = 7.8; BRD4 (BD2) pIC50 = 7.8; BRDT (BD2) pIC50 = 7.4	True	CNC(=O)c1cc(C(=O)N[C@H]2[C@@H]3COC[C@@H]32)cc2c1O[C@H](CF)[C@H]2c1ccccc1
417572:01:03_10.00	8.1	100	417572	246456:01:04_10.00	246456	76.1	35.8	10.0	97	Cisapride	5-HT antagonist.	False	COc1cc(N)c(Cl)cc1C(=O)N[C@H]1CCN(CCCOc2ccc(F)cc2)C[C@H]1OC
417572:01:03_10.00	8.1	100	417572	412681:01:04_30.00	412681	75.5	59.9	30.0	70	Dasabuvir	Dasabuvir (ABT-333) is a nonnucleoside inhibitor of the RNA-dependent RNA polymerase encoded by the HCV NS5B gene, inhibits recombinant NS5B polymerases derived from HCV genotype 1a and 1b clinical isolates, with IC50 between 2.2 and 10.7 nM.	False	COc1c(-c2ccc3cc(NS(C)(=O)=O)ccc3c2)cc(-n2ccc(=O)[nH]c2=O)cc1C(C)(C)C
417572:01:03_10.00	8.1	100	417572	519823:01:02_30.00	519823	75.4	25.4	30.0	98		BIIE0246 acts as a non-peptide neuropeptide Y (NPY) receptor antagonist with unprecedented affinity and high selectivity for the Y2R subtype. In ligand binding studies BIIE0246 was able to displace the specific binding of radiolabelled NPY from hY2 sites on SMS-KAN cells with an IC50 of 3.3 nM whereas no displacement was observed from human Y1, Y4 and Y5 specific binding sites in concentrations up to 1 .u.M.	False	N=C(N)NCCC[C@H](NC(=O)CC1(CC(=O)N2CCN(C3c4ccccc4NC(=O)c4ccccc43)CC2)CCCC1)C(=O)NCCn1c(=O)n(-c2ccccc2)n(-c2ccccc2)c1=O
417572:01:03_10.00	8.1	100	417572	413179:01:02_03.00	413179	75.2	7.4	3.0	103		PPTN is an antagonist of P2RY14 (GPR105). IC50 = 0.5 nM (FLIPR assay). Negative control = PPTN-1-NC	False	O=C(O)c1cc(-c2ccc(C3CCNCC3)cc2)c2ccc(-c3ccc(C(F)(F)F)cc3)cc2c1
417572:01:03_10.00	8.1	100	417572	280128:01:04_10.00	280128	75.0	51.3	10.0	99	U-73343	inactive analog of U73122 (Rack 16, Well D06).	False	COc1ccc2c(c1)CCC1C2CC[C@@]2(C)C1CC[C@@H]2NCCCCCCN1C(=O)CCC1=O
417572:01:03_10.00	8.1	100	417572	413008:01:03_10.00	413008	74.9	79.1	10.0	102	Src Inhibitor 1	Src Inhibitor 1 is a potent and selective dual site Src tyrosine kinase inhibitor with IC50 values of 44 nM for Src and 88nM for Lck.	False	COc1cc2ncnc(Nc3ccc(Oc4ccccc4)cc3)c2cc1OC
417572:01:03_10.00	8.1	100	417572	413134:02:04_30.00	413134	74.8	11.4	30.0	96	Ogerin negative control	Ogerin negative control is a structurally similar analog of ogerin (catalog no. SML1482). Ogerin is a selective positive allosteric modulator of an orphan GPCR, GPR68, also known as Ovarian cancer G-protein coupled receptor 1 (OGR1).	False	Nc1nc(NCc2ccccc2)nc(-c2cccc(CO)c2)n1
417572:01:03_10.00	8.1	100	417572	246897:02:03_10.00	246897	74.7	9.5	10.0	87	Opipramol, dihydrochloride	sigma1, sigma2 receptor agonist, an antagonist at D2, 5HT2, and H1 receptors, atypical antidepressant, antipsychotic, and axiolytic.	False	OCCN1CCN(CCCN2c3ccccc3C=Cc3ccccc32)CC1
417594:01:03_10.00	29.2	100	417594	413094:01:04_30.00	413094	87.2	22.3	30.0	96	PF-05190457	PF-5190457 is a potent and selective ghrelin receptor inverse agonist with a pKi of 8.36.	True	Cc1cc(-c2ccc3c(c2)CC[C@H]3N2CC3(CCN(C(=O)Cc4cn5cc(C)sc5n4)CC3)C2)ncn1
417594:01:03_10.00	29.2	100	417594	409343:02:02_03.00	409343	86.2	57.2	3.0	92	BAY-309,control for BAY-826	negative control to BAY-826	False	Cc1cc(NC(=O)c2cccc(S(F)(F)(F)(F)F)c2)cc(-n2ccn3nc(-c4cccnc4)cc23)c1
417594:01:03_10.00	29.2	100	417594	287906:02:09_10.00	287906	85.7	38.3	10.0	98	Pipinib	Hedgehog pathway Inhibitor; targets PI4KIIIß.	False	COC(=O)c1ccc(Nc2nc(NC(C)C)nc3ccsc23)cc1
417594:01:03_10.00	29.2	100	417594	246897:02:03_10.00	246897	84.39999999999999	9.5	10.0	87	Opipramol, dihydrochloride	sigma1, sigma2 receptor agonist, an antagonist at D2, 5HT2, and H1 receptors, atypical antidepressant, antipsychotic, and axiolytic.	False	OCCN1CCN(CCCN2c3ccccc3C=Cc3ccccc32)CC1
417594:01:03_10.00	29.2	100	417594	247020:01:04_10.00	247020	84.2	24.4	10.0	97	Cinnarizine	Cinnarizine is an antihistamine and a calcium channel blocker, promote cerebral blood flow, used to treat cerebral apoplexy, post-trauma cerebral symptoms, and cerebral arteriosclerosis.	False	C(=C/c1ccccc1)\CN1CCN(C(c2ccccc2)c2ccccc2)CC1
417594:01:03_10.00	29.2	100	417594	520969:01:04_50.00	520969	84.1	72.9	50.0	95	ML241 (hydrochloride)	ML241 hydrochloride is a potent p97 inhibitor, inhibiting p97 ATPase with IC50 value of 100 nM.	False	c1ccc(CNc2nc(N3CCOc4ccccc43)nc3c2CCCC3)cc1
417594:01:03_10.00	29.2	100	417594	391492:01:14_10.00	391492	84.1	21.6	10.0	95	SAR405	the activity of SAR405 was evaluated on a dedicated Vps34 cellular assay. Using a GFP-FYVE¿transfected HeLa cell line, treatment with SAR405 triggered the relocalization of GFP-FYVE inside the cell without affecting GFP intensity. Binding of SAR405 to the ATP site of protein and lipid kinases from the lysate of Jurkat cells was measured after incubation at 1 µM, which is more than 600-fold the KD for recombinant Vps34. Results confirmed very potent binding to endogenous Vps34 (&gt;94% inhibition).	True	C[C@@H]1COCCN1c1cc(=O)n2c(n1)N(Cc1cncc(Cl)c1)[C@H](C(F)(F)F)CC2
417594:01:03_10.00	29.2	100	417594	520746:01:02_50.00	520746	83.89999999999999	17.1	50.0	105	Emerione A		True	CC1=C[C@@]2(C)[C@@H](/C(C)=C/[C@]3(C)O[C@H](C)[C@@]4(C)O[C@H]43)[C@](C)([C@@H](O)[C@@H](C)C(=O)C(C)C)[C@H]2[C@]2(C)O[C@H]12
417594:01:03_10.00	29.2	100	417594	247342:01:05_10.00	247342	83.6	10.0	10.0	103	Doxazosin mesylate	alpha1 adrenoceptor blocker, Alpha 1 adrenergic antagonist, antihypertensive.	False	COc1cc2nc(N3CCN(C(=O)C4COc5ccccc5O4)CC3)nc(N)c2cc1OC
417594:01:03_10.00	29.2	100	417594	528529:01:02_03.00	528529	83.39999999999999	11.2	3.0	101		negative control to FM-381	False	CN(C)C(=O)/C(C#N)=C/c1ccc(-c2nc3cnc4c(ccn4C)c3n2C2CCCCC2)o1
417609:01:03_10.00	7.9	84	417609	247197:01:04_10.00	247197	80.2	30.4	10.0	102	Oxethazaine	Oxethazaine (Oxetacaine), a precursor of phentermineacidic,  is an acid-resistent and orally active analgesic agent. Oxethazaine (Oxetacaine) has the potential for the relief of pain associated withpeptic ulcer diseaseoresophagitis.	False	CN(C(=O)CN(CCO)CC(=O)N(C)C(C)(C)Cc1ccccc1)C(C)(C)Cc1ccccc1
417609:01:03_10.00	7.9	84	417609	246456:01:04_10.00	246456	79.9	35.8	10.0	97	Cisapride	5-HT antagonist.	False	COc1cc(N)c(Cl)cc1C(=O)N[C@H]1CCN(CCCOc2ccc(F)cc2)C[C@H]1OC
417609:01:03_10.00	7.9	84	417609	247342:01:05_10.00	247342	78.9	10.0	10.0	103	Doxazosin mesylate	alpha1 adrenoceptor blocker, Alpha 1 adrenergic antagonist, antihypertensive.	False	COc1cc2nc(N3CCN(C(=O)C4COc5ccccc5O4)CC3)nc(N)c2cc1OC
417609:01:03_10.00	7.9	84	417609	280360:01:03_10.00	280360	78.8	19.3	10.0	105	CGS-12066A maleate	5-HT1B Serotonin receptor agonist.	False	CN1CCN(c2nc3cc(C(F)(F)F)ccc3n3cccc23)CC1
417609:01:03_10.00	7.9	84	417609	412681:01:04_30.00	412681	78.8	59.9	30.0	70	Dasabuvir	Dasabuvir (ABT-333) is a nonnucleoside inhibitor of the RNA-dependent RNA polymerase encoded by the HCV NS5B gene, inhibits recombinant NS5B polymerases derived from HCV genotype 1a and 1b clinical isolates, with IC50 between 2.2 and 10.7 nM.	False	COc1c(-c2ccc3cc(NS(C)(=O)=O)ccc3c2)cc(-n2ccc(=O)[nH]c2=O)cc1C(C)(C)C
417609:01:03_10.00	7.9	84	417609	247167:01:04_10.00	247167	78.60000000000001	7.3	10.0	100	Lovastatin	Lovastatin is a cell-permeable HMG-CoA reductase inhibitor used to lower cholesterol.	True	CC[C@H](C)C(=O)O[C@H]1C[C@@H](C)C=C2C=C[C@H](C)[C@H](CC[C@@H]3C[C@@H](O)CC(=O)O3)[C@H]21
417609:01:03_10.00	7.9	84	417609	246433:01:04_10.00	246433	78.60000000000001	14.3	10.0	106	Diperodon hydrochloride	Sodium channel alpha subunits; brain (Types I, II, III) (IC50 = 1300 nM) and inhibition of Anandamide amidohydrolase	False	O=C(Nc1ccccc1)OCC(CN1CCCCC1)OC(=O)Nc1ccccc1
417609:01:03_10.00	7.9	84	417609	382135:02:03_30.00	382135	78.4	30.7	30.0	98	CH-223191	CH-223191 is a potent and specific aryl hydrocarbon receptor (AhR) antagonist. It inhibited TCDD-mediated nuclear translocation and DNA binding of AhR, and inhibited TCDD-induced luciferase activity with an IC50 of 30nM.	False	Cc1ccccc1/N=N/c1ccc(NC(=O)c2ccnn2C)c(C)c1
417609:01:03_10.00	7.9	84	417609	382185:03:06_10.00	382185	78.2	25.7	10.0	98	Aumitin	inhibits mitochondrial respiration by targeting complex I.; Chem. Sci. 2018, 9, 3014	False	Cc1cc(Nc2ccccc2)nc(Nc2ccc(NC(=O)c3ccccc3Cl)cc2)n1
417609:01:03_10.00	7.9	84	417609	412998:01:02_10.00	412998	78.0	33.2	10.0	106	Halopemide	Halopemide is a potent phospholipase D (PLD) inhibitor, with IC50s of 220 and 310 nM for human PLD1 and PLD2, respectively. Halopemid is a dopamine receptors antagonist, and acts a psychotropic agent.	False	O=C(NCCN1CCC(n2c(O)nc3cc(Cl)ccc32)CC1)c1ccc(F)cc1
417626:01:03_10.00	22.6	101	417626	413117:01:03_10.00	413117	80.4	12.4	10.0	95	CGP 53353	Selective inhibitor of PKC.b.II (IC50 values are 0.41 and 3.8 uM for PKC.b.II and PKC.b.I respectively). Also inhibits prionogenic Sup35 fibrillization (IC50 ~ 3.4 uM) and inhibits de novo A.b.42 assembly in vitro.	False	O=C1NC(=O)c2cc(Nc3ccc(F)cc3)c(Nc3ccc(F)cc3)cc21
417626:01:03_10.00	22.6	101	417626	413161:01:02_03.00	413161	78.3	6.2	3.0	99		negative control to A1596586	True	COc1ccc2c(c1)O[C@H](c1ccc(OC)c(OC)c1)C[C@@H]2NC(=O)C1(c2ccc3c(c2)OC(F)(F)O3)CC1
417626:01:03_10.00	22.6	101	417626	407872:01:03_10.00	407872	77.4	23.3	10.0	108	Erastin	a cell-permeable piperazinyl-quinazolinone compound that exhibits oncogene-selective lethality. Shown to bind mitochondrial voltage-dependent anion channels (VDAC) and alter its gating; rapidly induce an oxidative, non-apoptotic cell death in several human tumors harboring activating mutations in the RAS-RAF-MEK signaling (EC50 = 6.0 µM in BJ-TERT/LT/ST/RASV12 cells).; Yagoda, N., et al. 2007. Nature 447, 864.	False	CCOc1ccccc1-n1c(C(C)N2CCN(C(=O)COc3ccc(Cl)cc3)CC2)nc2ccccc2c1=O
417626:01:03_10.00	22.6	101	417626	280115:01:03_30.00	280115	77.2	19.9	30.0	92	JX401	potent, non-cytotoxic, membrane permeable p38a MAPK inhibitor.	False	COc1cc(SC)ccc1C(=O)N1CCC(Cc2ccccc2)CC1
417626:01:03_10.00	22.6	101	417626	407872:01:06_10.00	407872	76.8	22.3	10.0	104	Erastin	a cell-permeable piperazinyl-quinazolinone compound that exhibits oncogene-selective lethality. Shown to bind mitochondrial voltage-dependent anion channels (VDAC) and alter its gating; rapidly induce an oxidative, non-apoptotic cell death in several human tumors harboring activating mutations in the RAS-RAF-MEK signaling (EC50 = 6.0 µM in BJ-TERT/LT/ST/RASV12 cells).; Yagoda, N., et al. 2007. Nature 447, 864.	False	CCOc1ccccc1-n1c(C(C)N2CCN(C(=O)COc3ccc(Cl)cc3)CC2)nc2ccccc2c1=O
417626:01:03_10.00	22.6	101	417626	280355:01:03_30.00	280355	76.5	19.3	30.0	100	BRL 15572	potent and selective 5-HT1D serotonin receptor antagonist.	False	OC(CN1CCN(c2cccc(Cl)c2)CC1)C(c1ccccc1)c1ccccc1
417626:01:03_10.00	22.6	101	417626	280670:01:03_30.00	280670	76.4	34.5	30.0	96	LY-367,265	inhibits serotonin reuptake, 5-HT2A serotonin receptor antagonist.	False	O=S1(=O)N(CCN2CC=C(c3c[nH]c4cc(F)ccc34)CC2)c2cccc3c2N1CCC3
417626:01:03_10.00	22.6	101	417626	519813:01:03_10.00	519813	76.4	11.6	10.0	101		BI-3257 is an inhibitor of HIV replication with nanomolar activity. It prevents the formation of the capsid core structure that encapsulates the viral genome and its associated enzymes, reverse transcriptase and integrase. BI-3257 binds to an induced pocket in the N-terminal domain of the capsid protein and induces significant structural changes (displacement of the .a.1-helix), likely affecting the protein-protein interactions that define the regular structures of the viral capsid core. The binding location of BI-3257-type compounds in the capsid monomer was elucidated by X-ray crystallography, and electron microscopy allowed the elucidation of its mode of action. Due to this innovative mechanism of viral replication, BI-3257 is equally potent against the wild-type as well as mutant viruses that are resistant to the four major classes of antiretroviral inhibitors	False	CCCn1cc(-c2cc(C3C(=O)N(CC)c4ccc(C(F)(F)F)cc4N(c4ccccc4)C3=O)cc(OC)c2O)cn1
417626:01:03_10.00	22.6	101	417626	280424:01:03_30.00	280424	76.3	17.8	30.0	96	N-(2-[4-(4-Chlorophenyl)piperazin-1-yl]ethyl)-3-methoxybenzamide	selective D4 dopamine receptor agonist.	False	COc1cccc(C(=O)NCCN2CCN(c3ccc(Cl)cc3)CC2)c1
417626:01:03_10.00	22.6	101	417626	412994:01:03_06.00	412994	76.2	22.6	6.0	90	Lonafarnib	Lonafarnib is an orally bioavailable farnesyl protein transferase (FPTase) inhibitor for H-ras, K-ras and N-ras with IC50 of 1.9 nM, 5.2 nM and 2.8 nM, respectively. Lonafarnib has anti-hepatitis delta virus (HDV) activities.	True	NC(=O)N1CCC(CC(=O)N2CCC([C@H]3c4ncc(Br)cc4CCc4cc(Cl)cc(Br)c43)CC2)CC1
417631:01:03_10.00	35.9	96	417631	247238:02:03_30.00	247238	87.0	50.6	30.0	104	Trihexyphenidyl (hydrochloride)	Trihexyphenidyl hydrochloride is an antiparkinsonian agent of the antimuscarinic class, binds to the M1 muscarinic receptor.	False	OC(CCN1CCCCC1)(c1ccccc1)C1CCCCC1
417631:01:03_10.00	35.9	96	417631	409878:01:04_50.00	409878	86.4	56.0	50.0	98	OF-1	OF-1 is a potent pan-BRPF bromodomain (BRD) inhibitor, with IC50 values of 270 nM, 1.2 uM for TRIM24 and BRPF1B, respectively.	False	COc1cc2c(cc1NS(=O)(=O)c1ccc(Br)cc1C)n(C)c(=O)n2C
417631:01:03_10.00	35.9	96	417631	280571:01:03_30.00	280571	85.6	76.2	30.0	88	GW2974	GW2974 is a dual selective inhibitor of EGFR and Neu (ErbB-2) receptor tyrosine kinases.  Receptor protein-tyrosine kinase erbB-2/4 (IC50 = 0.02/0.02 µM),  Epidermal growth factor receptor erbB1 (IC50 = 0.21 µM); Indazolylamino quinazolines and pyridopyrimidines as inhibitors of the EGFr and c-erbB-2.  Bioorg Med Chem Lett.  (2001),  11(11),  1401-1405.	False	CN(C)c1cc2c(Nc3ccc4c(cnn4Cc4ccccc4)c3)ncnc2cn1
417631:01:03_10.00	35.9	96	417631	280904:01:03_30.00	280904	85.3	45.4	30.0	101	PAPP, LY-165,163, p-Aminophenethyl-m-trifluoromethylphenyl piperazine	selective 5-HT1A serotonin receptor agonist.	False	Nc1ccc(CCN2CCN(c3cccc(C(F)(F)F)c3)CC2)cc1
417631:01:03_10.00	35.9	96	417631	246866:02:03_10.00	246866	85.2	27.8	10.0	94	Cilnidipine	slow-acting Ca2+ channel blocker, antihypertensive, vasodilator. Does not inhibit PKC.	False	COCCOC(=O)C1=C(C)NC(C)=C(C(=O)OC/C=C/c2ccccc2)C1c1cccc([N+](=O)[O-])c1
417631:01:03_10.00	35.9	96	417631	280468:01:03_30.00	280468	84.2	31.1	30.0	95	WB-4101 hydrochloride	alpha1A Adrenoceptor antagonist.	False	COc1cccc(OC)c1OCCNCC1COc2ccccc2O1
417631:01:03_10.00	35.9	96	417631	280016:01:03_30.00	280016	84.0	40.6	30.0	97	LY-53,857 maleate	potent and selective 5-HT2 serotonin receptor antagonist.	False	CC(O)C(C)OC(=O)[C@@H]1C[C@@H]2c3cccc4c3c(cn4C(C)C)C[C@H]2N(C)C1
417631:01:03_10.00	35.9	96	417631	520969:01:04_50.00	520969	83.39999999999999	72.9	50.0	95	ML241 (hydrochloride)	ML241 hydrochloride is a potent p97 inhibitor, inhibiting p97 ATPase with IC50 value of 100 nM.	False	c1ccc(CNc2nc(N3CCOc4ccccc43)nc3c2CCCC3)cc1
417631:01:03_10.00	35.9	96	417631	409878:01:04_30.00	409878	83.39999999999999	43.4	30.0	98	OF-1	OF-1 is a potent pan-BRPF bromodomain (BRD) inhibitor, with IC50 values of 270 nM, 1.2 uM for TRIM24 and BRPF1B, respectively.	False	COc1cc2c(cc1NS(=O)(=O)c1ccc(Br)cc1C)n(C)c(=O)n2C
417631:01:03_10.00	35.9	96	417631	520969:01:04_30.00	520969	83.1	43.2	30.0	92	ML241 (hydrochloride)	ML241 hydrochloride is a potent p97 inhibitor, inhibiting p97 ATPase with IC50 value of 100 nM.	False	c1ccc(CNc2nc(N3CCOc4ccccc43)nc3c2CCCC3)cc1
417665:01:03_10.00	14.7	104	417665	392290:03:03_50.00	392290	84.0	28.0	50.0	98	GSK2606414	GSK2606414 is a cell-permeable and orally available protein kinase R-like endoplasmic reticulum (ER) kinase (PERK) inhibitor with an IC50 of 0.4 nM.; Discovery of 7-Methyl-5-(1-{[3-(trifluoromethyl)phenyl]acetyl}-2,3-dihydro-1H-indol-5-yl)-7H-pyrrolo[2,3-d]pyrimidin-4-amine (GSK2606414), a Potent and Selective First-in-Class Inhibitor of Protein Kinase R (PKR)-like Endoplasmic Reticulum Kinase (PERK) J. Med. Chem. 2012	False	Cn1cc(-c2ccc3c(c2)CCN3C(=O)Cc2cccc(C(F)(F)F)c2)c2c(N)ncnc21
417665:01:03_10.00	14.7	104	417665	392290:03:03_30.00	392290	78.60000000000001	26.3	30.0	91	GSK2606414	GSK2606414 is a cell-permeable and orally available protein kinase R-like endoplasmic reticulum (ER) kinase (PERK) inhibitor with an IC50 of 0.4 nM.; Discovery of 7-Methyl-5-(1-{[3-(trifluoromethyl)phenyl]acetyl}-2,3-dihydro-1H-indol-5-yl)-7H-pyrrolo[2,3-d]pyrimidin-4-amine (GSK2606414), a Potent and Selective First-in-Class Inhibitor of Protein Kinase R (PKR)-like Endoplasmic Reticulum Kinase (PERK) J. Med. Chem. 2012	False	Cn1cc(-c2ccc3c(c2)CCN3C(=O)Cc2cccc(C(F)(F)F)c2)c2c(N)ncnc21
417665:01:03_10.00	14.7	104	417665	392290:03:03_10.00	392290	75.1	14.2	10.0	94	GSK2606414	GSK2606414 is a cell-permeable and orally available protein kinase R-like endoplasmic reticulum (ER) kinase (PERK) inhibitor with an IC50 of 0.4 nM.; Discovery of 7-Methyl-5-(1-{[3-(trifluoromethyl)phenyl]acetyl}-2,3-dihydro-1H-indol-5-yl)-7H-pyrrolo[2,3-d]pyrimidin-4-amine (GSK2606414), a Potent and Selective First-in-Class Inhibitor of Protein Kinase R (PKR)-like Endoplasmic Reticulum Kinase (PERK) J. Med. Chem. 2012	False	Cn1cc(-c2ccc3c(c2)CCN3C(=O)Cc2cccc(C(F)(F)F)c2)c2c(N)ncnc21
417665:01:03_10.00	14.7	104	417665	412994:01:03_06.00	412994	72.3	22.6	6.0	90	Lonafarnib	Lonafarnib is an orally bioavailable farnesyl protein transferase (FPTase) inhibitor for H-ras, K-ras and N-ras with IC50 of 1.9 nM, 5.2 nM and 2.8 nM, respectively. Lonafarnib has anti-hepatitis delta virus (HDV) activities.	True	NC(=O)N1CCC(CC(=O)N2CCC([C@H]3c4ncc(Br)cc4CCc4cc(Cl)cc(Br)c43)CC2)CC1
417665:01:03_10.00	14.7	104	417665	412994:01:03_10.00	412994	71.6	30.9	10.0	95	Lonafarnib	Lonafarnib is an orally bioavailable farnesyl protein transferase (FPTase) inhibitor for H-ras, K-ras and N-ras with IC50 of 1.9 nM, 5.2 nM and 2.8 nM, respectively. Lonafarnib has anti-hepatitis delta virus (HDV) activities.	True	NC(=O)N1CCC(CC(=O)N2CCC([C@H]3c4ncc(Br)cc4CCc4cc(Cl)cc(Br)c43)CC2)CC1
417665:01:03_10.00	14.7	104	417665	519808:01:04_50.00	519808	68.5	47.0	50.0	77		BI-1046 has been identified as a potent and selective GPR142 agonist which increases Gq-coupled signalling in cells of recombinant and endogenous receptor expression. BI-1046 displays high potency with an EC50 of 0.05 nM in an IP1-based cellular assay. The GPR142 agonistic activity of BI-1046 has been demonstrated to potentiate glucose-stimulated insulin secretion from mouse islets, a physiological response that translates into improved glucose tolerance in mice when investigated in an acute oral glucose tolerance test.	False	Cn1cncc1-c1cn(-c2cccc(C(=O)Nc3cccc(C(F)(F)F)c3)c2)nn1
417718:01:03_10.00	11.4	99	417718	247001:01:04_30.00	247001	81.2	10.9	30.0	92	Niflumic acid	Niflumic acid, a Ca2+-activated Cl- channel blocker, is an analgesic and anti-inflammatory agent used in the treatment of rheumatoid arthritis.Target: Othersniflumic acid, an inhibitor of calcium-activated chloride currents. Niflumic acid does not block directly calcium channels or activate potassium channels. Niflumic acid selectively reduces a component of noradrenaline- and 5-HT-induced pressor responses by inhibiting a mechanism which leads to the opening of voltage-gated calcium channels . Niflumic acid molecule is completely buried in the substrate-binding hydrophobic channel. The conformations of the binding site in PLA(2) as well as that of niflumic acid are not altered upon binding . Niflumic acid (NFA) produces biphasic behavior on human CLC-K channels that suggests the presence of two functionally different binding sites: an activating site and a blocking site .	False	O=C(O)c1cccnc1Nc1cccc(C(F)(F)F)c1
