Well_Id	Induction	Rel_Cell_Count	Compound_Id	Ref_Id	RefCpd_Id	Similarity	Induction_Ref	Conc_uM_Ref	Rel_Cell_Count_Ref	Trivial_Name_Ref	Known_Act_Ref	Chiral_Ref	Smiles_Ref
416216:01:03_10.00	7.4	95	416216	413219:01:04_50.00	413219	76.2	8.5	50.0	102	LDN-27219	LDN-27219 is a potent inhibitor of hTGase(Tissue transglutaminase) with an IC50 of 0.6 uM.IC50 value: 0.6 uM Target: hTGase inhibitorLDN-27219 is a potent inhibitor of the enzyme(hTGase), producing 100% inhibition at the screening concentration of 10 uM. To examine the enzyme selectivity of LDN-27219, it was tested as an inhibitor of coagulation Factor XIIIa and caspase 3. At concentrations as high as 50 íM, the compound had no effect on the activities of either of these enzymes. LDN-27219 was found to be nontoxic at concentrations as high as 100 íM in an assay that measures the viability of HT1080 cells, a fibrosarcoma tumor cell line.	False	NNC(=O)CSc1nc2scc(-c3ccccc3)c2c(=O)n1-c1ccccc1
416216:01:03_10.00	7.4	95	416216	409837:01:03_10.00	409837	74.4	13.1	10.0	97	GSK-5959	GSK-5959 is a potent, selective and cell permeable BRPF1 bromodomain inhibitor with an IC50 of ~ 80 nM.	False	COc1ccccc1C(=O)Nc1cc2c(cc1N1CCCCC1)n(C)c(=O)n2C
416216:01:03_10.00	7.4	95	416216	410662:01:04_10.00	410662	73.9	9.8	10.0	102	Ticagrelor	Ticagrelor (AZD6140) is a reversible oral P2Y12 receptor antagonist for the treatment of platelet aggregation.	True	CCCSc1nc(N[C@@H]2C[C@H]2c2ccc(F)c(F)c2)c2nnn([C@@H]3C[C@H](OCCO)[C@@H](O)[C@H]3O)c2n1
416216:01:03_10.00	7.4	95	416216	247342:02:04_10.00	247342	73.9	18.5	10.0	99	Doxazosin mesylate	alpha1 adrenoceptor blocker, Alpha 1 adrenergic antagonist, antihypertensive.	False	COc1cc2nc(N3CCN(C(=O)C4COc5ccccc5O4)CC3)nc(N)c2cc1OC
416216:01:03_10.00	7.4	95	416216	280639:03:03_10.00	280639	72.89999999999999	17.6	10.0	99	ML-7 (hydrochloride)	ML-7 hydrochloride is a naphthalene sulphonamide derivative, potently inhibits MLCK (IC50=300 nM). ML-7 hydrochloride also inhibits YAP/TAZ.	False	O=S(=O)(c1cccc2c(I)cccc12)N1CCCNCC1
416216:01:03_10.00	7.4	95	416216	246791:02:03_30.00	246791	72.5	20.0	30.0	102	Chlorpheniramine (maleate)	Chlorpheniramine maleate is an histamine H1 receptor antagonist with IC50 of 12 nM.Target: Histamine H1 ReceptorChlorpheniramine inhibits the proliferation of MCF-7, MDA-MB 231, and Ehrlich cells in a dose-response manner, and significantly reduces the ornithine decarboxylase mRNA translation by 50%-70% at the 250 uM . Chlorpheniramine displaces of [3H]pyrilamine from human histamine receptor subtype 1 expressed in CHO cells with IC50 of 66 nM. Chlorpheniramine displays antimalarial activity against CQS strain (D6) and MDR strain (Dd2) of P. falciparum with IC50 of 61.2 uM and 3.9 uM, respectively. Chlorpheniramine displays cytotoxicity against the proliferation of concanavalin A-induced murine splenic lymphocytes with IC50 of 33.4 uM .Oral administration of Chlorpheniramine inhibits histamine-induced mortality in guinea pigs with an ED50 of 0.17 mg/kg . Oral administration of Chlorpheniramine (10 mg/kg) significantly inhibits short-duration scratching in BALB/c mice stimulated by ovalbumin active cutaneous anaphylaxis and in ICR mice subcutaneously injected with histamine, but not long-duration scratching seen in NC/Nga mice, in contrast to that of dexamethasone or tacrolimus .	False	CN(C)CCC(c1ccc(Cl)cc1)c1ccccn1
416216:01:03_10.00	7.4	95	416216	409831:01:03_01.00	409831	71.1	32.0	1.0	101	JQEZ5	JQEZ5 is a potent and selective EZH2 lysine methyltransferase inhibitor. JQEZ5 SAM-competitive inhibition of polycomb repressive complex 2 (PRC2) with an IC50 of 80 nM. JQEZ5 has anti-tumor effects.	False	CCCc1cc(C)[nH]c(=O)c1CNC(=O)c1cc(-c2ccc(N3CCN(C)CC3)nc2)nc2c1cnn2C(C)C
416216:01:03_10.00	7.4	95	416216	407872:01:03_10.00	407872	71.0	23.3	10.0	108	Erastin	a cell-permeable piperazinyl-quinazolinone compound that exhibits oncogene-selective lethality. Shown to bind mitochondrial voltage-dependent anion channels (VDAC) and alter its gating; rapidly induce an oxidative, non-apoptotic cell death in several human tumors harboring activating mutations in the RAS-RAF-MEK signaling (EC50 = 6.0 µM in BJ-TERT/LT/ST/RASV12 cells).; Yagoda, N., et al. 2007. Nature 447, 864.	False	CCOc1ccccc1-n1c(C(C)N2CCN(C(=O)COc3ccc(Cl)cc3)CC2)nc2ccccc2c1=O
416221:01:03_10.00	27.1	101	416221	247095:02:03_30.00	247095	88.6	36.3	30.0	101	Nicardipine hydrochloride, YC-93 hydrochloride	L-type Ca2+ channel antagonist, antihypertensive, vasodilator.	False	COC(=O)C1=C(C)NC(C)=C(C(=O)OCCN(C)Cc2ccccc2)C1c1cccc([N+](=O)[O-])c1
416221:01:03_10.00	27.1	101	416221	280127:01:04_30.00	280127	87.7	46.5	30.0	91	ABT-702 dihydrochloride	ABT-702 dihydrochloride is a potent adenosine kinase (AK) inhibitor (IC50=1.7 nM).	False	Nc1ncnc2nc(-c3ccc(N4CCOCC4)nc3)cc(-c3cccc(Br)c3)c12
416221:01:03_10.00	27.1	101	416221	280474:01:03_30.00	280474	87.3	31.8	30.0	92	Droperidol	D1, D2 dopamine receptor antagonist.	False	O=C(CCCN1C=CC(n2c(=O)[nH]c3ccccc32)CC1)c1ccc(F)cc1
416221:01:03_10.00	27.1	101	416221	413121:01:03_30.00	413121	87.3	21.2	30.0	87	M 25	Potent Smoothened (Smo) receptor antagonist (IC50 = 5 nM). Inhibits the Hedgehog signaling pathway. Inhibits Shh induced Gli luciferase reporter activity in Shh-light 2 cells (IC50 = 5 nM). Antagonizes GSA-10 and SAG-mediated differentiation of the C3H10T1/2 cell line (IC50 values are 69 and 115 nM, respectively).	False	CCCC(CCC)C(=O)NCc1ccc2c(cnn2-c2ccccc2OC)c1
416221:01:03_10.00	27.1	101	416221	410031:02:03_30.00	410031	86.9	39.9	30.0	96	Opaganib (ABC294640)	orally bioavailable and selective sphingosine kinase-2 (SphK2) inhibitor with IC50 of approximately 60 µM.	False	O=C(NCc1ccncc1)C12CC3CC(C1)CC(c1ccc(Cl)cc1)(C3)C2
416221:01:03_10.00	27.1	101	416221	246363:01:04_30.00	246363	86.8	26.9	30.0	99	Tracazolate hydrochloride	GABA receptor modulator.	False	CCCCNc1c(C(=O)OCC)c(C)nc2c1cnn2CC
416221:01:03_10.00	27.1	101	416221	520969:01:04_30.00	520969	86.7	43.2	30.0	92	ML241 (hydrochloride)	ML241 hydrochloride is a potent p97 inhibitor, inhibiting p97 ATPase with IC50 value of 100 nM.	False	c1ccc(CNc2nc(N3CCOc4ccccc43)nc3c2CCCC3)cc1
416221:01:03_10.00	27.1	101	416221	247419:02:03_30.00	247419	86.5	72.2	30.0	96	Naftopidil dihydrochloride, KT-611 dihydrochloride	alpha1 Adrenoceptor antagonist, antihypertensive, Alpha1 agonist.	False	COc1ccccc1N1CCN(CC(O)COc2cccc3ccccc23)CC1
416221:01:03_10.00	27.1	101	416221	280670:01:03_30.00	280670	86.4	34.5	30.0	96	LY-367,265	inhibits serotonin reuptake, 5-HT2A serotonin receptor antagonist.	False	O=S1(=O)N(CCN2CC=C(c3c[nH]c4cc(F)ccc34)CC2)c2cccc3c2N1CCC3
416221:01:03_10.00	27.1	101	416221	280657:01:03_30.00	280657	86.4	52.3	30.0	91	K 185	melatonin receptor antagonist.	False	CCCC(=O)NCCc1c2n(c3ccc(OC)cc13)CCCc1ccccc1-2
416223:01:03_10.00	8.3	100	416223	280670:01:03_30.00	280670	83.0	34.5	30.0	96	LY-367,265	inhibits serotonin reuptake, 5-HT2A serotonin receptor antagonist.	False	O=S1(=O)N(CCN2CC=C(c3c[nH]c4cc(F)ccc34)CC2)c2cccc3c2N1CCC3
416223:01:03_10.00	8.3	100	416223	280076:01:03_30.00	280076	80.0	20.9	30.0	108	YM 976	phosphodiesterase type IV (PDE4) inhibitor. Exhibits anti-inflammatory activity without emesis.	False	CCc1ccc2c(-c3cccc(Cl)c3)nc(=O)n(CC)c2n1
416223:01:03_10.00	8.3	100	416223	247095:02:03_30.00	247095	79.80000000000001	36.3	30.0	101	Nicardipine hydrochloride, YC-93 hydrochloride	L-type Ca2+ channel antagonist, antihypertensive, vasodilator.	False	COC(=O)C1=C(C)NC(C)=C(C(=O)OCCN(C)Cc2ccccc2)C1c1cccc([N+](=O)[O-])c1
416223:01:03_10.00	8.3	100	416223	280107:01:03_30.00	280107	79.80000000000001	30.4	30.0	83	UCL 2077	slow afterhyperpolarization (sAHP) channel blocker.	False	c1ccc(C(NCc2cccnc2)(c2ccccc2)c2ccccc2)cc1
416223:01:03_10.00	8.3	100	416223	280657:01:03_30.00	280657	79.7	52.3	30.0	91	K 185	melatonin receptor antagonist.	False	CCCC(=O)NCCc1c2n(c3ccc(OC)cc13)CCCc1ccccc1-2
416223:01:03_10.00	8.3	100	416223	410626:01:03_02.00	410626	79.3	11.2	2.0	98	Nebivolol HCl	Nebivolol HCl selectively inhibits ß1-adrenoceptor with IC50 of 0.8 nM.	True	O[C@@H](CNC[C@H](O)[C@H]1CCc2cc(F)ccc2O1)[C@@H]1CCc2cc(F)ccc2O1
416223:01:03_10.00	8.3	100	416223	280424:01:03_30.00	280424	79.3	17.8	30.0	96	N-(2-[4-(4-Chlorophenyl)piperazin-1-yl]ethyl)-3-methoxybenzamide	selective D4 dopamine receptor agonist.	False	COc1cccc(C(=O)NCCN2CCN(c3ccc(Cl)cc3)CC2)c1
416223:01:03_10.00	8.3	100	416223	410755:01:03_02.00	410755	78.7	21.2	2.0	99	L755507	L-755,507 is characterized as a potent and selective ß3 adrenergic receptor partial agonist with EC50 of 0.43 nM. It is also recently identified to enhance CRISPR-mediated homology-directed repair (HDR) efficiency in human induced pluripotent stem cells (iPSCs) and other cell types.	True	CCCCCCNC(=O)Nc1ccc(S(=O)(=O)Nc2ccc(CCNC[C@H](O)COc3ccc(O)cc3)cc2)cc1
416223:01:03_10.00	8.3	100	416223	280355:01:03_30.00	280355	78.10000000000001	19.3	30.0	100	BRL 15572	potent and selective 5-HT1D serotonin receptor antagonist.	False	OC(CN1CCN(c2cccc(Cl)c2)CC1)C(c1ccccc1)c1ccccc1
416223:01:03_10.00	8.3	100	416223	245387:02:04_30.00	245387	78.10000000000001	15.9	30.0	104	Tolnaftate	Tolnaftate (NP-27) is a synthetic thiocarbamate used as an anti-fungal agent. .	False	Cc1cccc(N(C)C(=S)Oc2ccc3ccccc3c2)c1
416225:01:03_10.00	17.1	94	416225	520969:01:04_30.00	520969	86.7	43.2	30.0	92	ML241 (hydrochloride)	ML241 hydrochloride is a potent p97 inhibitor, inhibiting p97 ATPase with IC50 value of 100 nM.	False	c1ccc(CNc2nc(N3CCOc4ccccc43)nc3c2CCCC3)cc1
416225:01:03_10.00	17.1	94	416225	413121:01:03_30.00	413121	86.0	21.2	30.0	87	M 25	Potent Smoothened (Smo) receptor antagonist (IC50 = 5 nM). Inhibits the Hedgehog signaling pathway. Inhibits Shh induced Gli luciferase reporter activity in Shh-light 2 cells (IC50 = 5 nM). Antagonizes GSA-10 and SAG-mediated differentiation of the C3H10T1/2 cell line (IC50 values are 69 and 115 nM, respectively).	False	CCCC(CCC)C(=O)NCc1ccc2c(cnn2-c2ccccc2OC)c1
416225:01:03_10.00	17.1	94	416225	246363:01:04_30.00	246363	85.39999999999999	26.9	30.0	99	Tracazolate hydrochloride	GABA receptor modulator.	False	CCCCNc1c(C(=O)OCC)c(C)nc2c1cnn2CC
416225:01:03_10.00	17.1	94	416225	247095:02:03_30.00	247095	85.3	36.3	30.0	101	Nicardipine hydrochloride, YC-93 hydrochloride	L-type Ca2+ channel antagonist, antihypertensive, vasodilator.	False	COC(=O)C1=C(C)NC(C)=C(C(=O)OCCN(C)Cc2ccccc2)C1c1cccc([N+](=O)[O-])c1
416225:01:03_10.00	17.1	94	416225	280657:01:03_30.00	280657	85.1	52.3	30.0	91	K 185	melatonin receptor antagonist.	False	CCCC(=O)NCCc1c2n(c3ccc(OC)cc13)CCCc1ccccc1-2
416225:01:03_10.00	17.1	94	416225	280400:01:03_30.00	280400	85.1	29.2	30.0	92	Cyproterone acetate	androgen antagonist, synthetic steroid.	False	CC(=O)O[C@]1(C(C)=O)CC[C@H]2[C@@H]3C=C(Cl)C4=CC(=O)[C@@H]5C[C@@H]5[C@]4(C)[C@H]3CC[C@@]21C
416225:01:03_10.00	17.1	94	416225	246846:01:05_30.00	246846	84.8	33.0	30.0	100	Loxapine (succinate)	Loxapine Succinate is a D2DR and D4DR inhibitor, serotonergic receptor antagonist and also a dibenzoxazepine anti-psychotic agent.IC50 value: Target: D2DR/D4DR; 5-HT receptorin vitro: In the presence of Loxapine, [3H]ketanserin binds to 5-HT2 receptor in Frontal cortex of brain in human and bovine with ki value of 6.2 nM and 6.6 nM, respectively. Loxapine has the rank order of potency for the various receptors appears to be as follows:5-HT2D4&gt;&gt;&gt;D1&gt;D2 in comparing competition experiments involving the human membranes . Loxapine 0.2 uM, 2 uM and 20 uM reduces IL-1beta secretion by LPS-activated mixed glia cultures after 1 and 3 days of exposure. Loxapine in concentrations of 0.2 uM, 2 uM and 20 uM reduces IL-2 secretion in mixed glia cultures after 1 and 3 days of exposure, and additionally Loxapine decreases IL-1beta and IL-2 secretion in LPS-induced microglia cultures in concentrations of 2 uM, 10 uM and 20 uM .in vivo: Loxapine (5 mg/kg) induces a very significant reduction (more than 50%) of serotonin (S2) receptor density after 4 weeks or 10 weeks of daily injection in the rat. Loxapine (5 mg/kg) does not change dopamine receptor density but greatly reduces serotonin receptor density by 47% in the brain of rats .	False	CN1CCN(C2=Nc3ccccc3Oc3ccc(Cl)cc32)CC1
416225:01:03_10.00	17.1	94	416225	246866:02:03_10.00	246866	84.39999999999999	27.8	10.0	94	Cilnidipine	slow-acting Ca2+ channel blocker, antihypertensive, vasodilator. Does not inhibit PKC.	False	COCCOC(=O)C1=C(C)NC(C)=C(C(=O)OC/C=C/c2ccccc2)C1c1cccc([N+](=O)[O-])c1
416225:01:03_10.00	17.1	94	416225	247209:01:04_30.00	247209	84.1	19.5	30.0	93	Quipazine dimaleate salt	5-HT agonist.	False	c1ccc2nc(N3CCNCC3)ccc2c1
416225:01:03_10.00	17.1	94	416225	246859:01:04_30.00	246859	83.89999999999999	34.2	30.0	108	Vardenafil	PDE5 inhibitor.	False	CCCc1nc(C)c2c(=O)nc(-c3cc(S(=O)(=O)N4CCN(CC)CC4)ccc3OCC)[nH]n12
416227:01:03_10.00	13.3	97	416227	409853:02:03_02.00	409853	78.4	14.7	2.0	97	Tubacin	Tubacin is a potent and selective inhibitor of HDAC6, with an IC50 value of 4 nM and approximately 350-fold selectivity over HDAC1.	True	O=C(CCCCCCC(=O)Nc1ccc([C@H]2O[C@@H](CSc3nc(-c4ccccc4)c(-c4ccccc4)o3)C[C@@H](c3ccc(CO)cc3)O2)cc1)NO
416227:01:03_10.00	13.3	97	416227	283242:02:05_10.00	283242	77.7	24.0	10.0	100	Englerin A	highly efficient, fast-acting, potent, selective, and direct stimulator of transient receptor potential canonical (TRPC) calcium channels TRPC4 and TRPC5.; Angew. Chem. Int. Ed. 2015, 54, 3787	False	CC(C)[C@@]12C[C@@H](OC(=O)CO)[C@@](C)(O1)[C@@H]1CC[C@@H](C)[C@H]1[C@@H]2OC(=O)/C=C/c1ccccc1
416227:01:03_10.00	13.3	97	416227	280562:01:03_30.00	280562	77.3	24.4	30.0	95	Flupirtine (Maleate)	Flupirtine Maleate is an indirect N-methyl-D-aspartate receptor (NMDAR) antagonist. It is a brain penetrant, and orally bioavailable, non-opioid and centrally acting analgesic agent.	False	CCOC(=O)Nc1ccc(NCc2ccc(F)cc2)nc1N
416227:01:03_10.00	13.3	97	416227	413161:01:02_03.00	413161	76.5	6.2	3.0	99		negative control to A1596586	True	COc1ccc2c(c1)O[C@H](c1ccc(OC)c(OC)c1)C[C@@H]2NC(=O)C1(c2ccc3c(c2)OC(F)(F)O3)CC1
416227:01:03_10.00	13.3	97	416227	407872:02:03_02.00	407872	76.2	13.5	2.0	100	Erastin	a cell-permeable piperazinyl-quinazolinone compound that exhibits oncogene-selective lethality. Shown to bind mitochondrial voltage-dependent anion channels (VDAC) and alter its gating; rapidly induce an oxidative, non-apoptotic cell death in several human tumors harboring activating mutations in the RAS-RAF-MEK signaling (EC50 = 6.0 µM in BJ-TERT/LT/ST/RASV12 cells).; Yagoda, N., et al. 2007. Nature 447, 864.	False	CCOc1ccccc1-n1c(C(C)N2CCN(C(=O)COc3ccc(Cl)cc3)CC2)nc2ccccc2c1=O
416227:01:03_10.00	13.3	97	416227	410626:01:03_02.00	410626	75.8	11.2	2.0	98	Nebivolol HCl	Nebivolol HCl selectively inhibits ß1-adrenoceptor with IC50 of 0.8 nM.	True	O[C@@H](CNC[C@H](O)[C@H]1CCc2cc(F)ccc2O1)[C@@H]1CCc2cc(F)ccc2O1
416227:01:03_10.00	13.3	97	416227	528529:01:02_01.00	528529	75.0	9.2	1.0	102		negative control to FM-381	False	CN(C)C(=O)/C(C#N)=C/c1ccc(-c2nc3cnc4c(ccn4C)c3n2C2CCCCC2)o1
416227:01:03_10.00	13.3	97	416227	246753:01:04_30.00	246753	74.3	9.8	30.0	91	Danazol	Danazol is a derivative of the synthetic steroid ethisterone, that suppresses the production of gonadotrophins, and has some weak androgenic effects.	True	C#C[C@]1(O)CC[C@H]2[C@@H]3CCC4=Cc5oncc5C[C@]4(C)[C@H]3CC[C@@]21C
416227:01:03_10.00	13.3	97	416227	392523:01:09_02.00	392523	74.3	19.7	2.0	99	CP-724714	CP-724714 is a potent, selective and orally active ErbB2 (HER2) tyrosine kinase inhibitor, with an IC50 of 10 nM. CP-724714 displays a marked selectivity against EGFR kinase (IC50=6400 nM). CP-724714 potently inhibits ErbB2 receptor autophosphorylation in intact cells. Antitumor activities.	False	COCC(=O)NC/C=C/c1ccc2ncnc(Nc3ccc(Oc4ccc(C)nc4)c(C)c3)c2c1
416227:01:03_10.00	13.3	97	416227	528554:01:02_05.00	528554	74.0	9.3	5.0	93		8RK59 is a covalent inhibitor of the deubiquitinating enzyme UCHL1, fluorescent probe.	True	CC1=CC(C)=[N+]2C1=C(CCCc1cn(CC(=O)N3CCc4nc(NC(=O)[C@H]5CCN(C#N)C5)sc4C3)nn1)c1c(C)cc(C)n1[B-]2(F)F
416257:01:03_10.00	19.0	99	416257	280474:01:03_30.00	280474	86.6	31.8	30.0	92	Droperidol	D1, D2 dopamine receptor antagonist.	False	O=C(CCCN1C=CC(n2c(=O)[nH]c3ccccc32)CC1)c1ccc(F)cc1
416257:01:03_10.00	19.0	99	416257	246859:01:04_30.00	246859	86.4	34.2	30.0	108	Vardenafil	PDE5 inhibitor.	False	CCCc1nc(C)c2c(=O)nc(-c3cc(S(=O)(=O)N4CCN(CC)CC4)ccc3OCC)[nH]n12
416257:01:03_10.00	19.0	99	416257	247095:02:03_30.00	247095	86.1	36.3	30.0	101	Nicardipine hydrochloride, YC-93 hydrochloride	L-type Ca2+ channel antagonist, antihypertensive, vasodilator.	False	COC(=O)C1=C(C)NC(C)=C(C(=O)OCCN(C)Cc2ccccc2)C1c1cccc([N+](=O)[O-])c1
416257:01:03_10.00	19.0	99	416257	528526:01:02_05.00	528526	86.0	11.9	5.0	109		NR162 is a potent and selective CASK (Ca2+/calmodulin-dependent Ser/Thr kinase) inhibitor with a Kd of 22 nM in ITC and IC50 of 80 nM in NanoBRET assay.	False	Cc1cc(Br)c(CNc2ncc(C(=O)NCCCN3CCOC3=O)c(NC3CCCC3)n2)cc1Br
416257:01:03_10.00	19.0	99	416257	246846:01:05_30.00	246846	85.2	33.0	30.0	100	Loxapine (succinate)	Loxapine Succinate is a D2DR and D4DR inhibitor, serotonergic receptor antagonist and also a dibenzoxazepine anti-psychotic agent.IC50 value: Target: D2DR/D4DR; 5-HT receptorin vitro: In the presence of Loxapine, [3H]ketanserin binds to 5-HT2 receptor in Frontal cortex of brain in human and bovine with ki value of 6.2 nM and 6.6 nM, respectively. Loxapine has the rank order of potency for the various receptors appears to be as follows:5-HT2D4&gt;&gt;&gt;D1&gt;D2 in comparing competition experiments involving the human membranes . Loxapine 0.2 uM, 2 uM and 20 uM reduces IL-1beta secretion by LPS-activated mixed glia cultures after 1 and 3 days of exposure. Loxapine in concentrations of 0.2 uM, 2 uM and 20 uM reduces IL-2 secretion in mixed glia cultures after 1 and 3 days of exposure, and additionally Loxapine decreases IL-1beta and IL-2 secretion in LPS-induced microglia cultures in concentrations of 2 uM, 10 uM and 20 uM .in vivo: Loxapine (5 mg/kg) induces a very significant reduction (more than 50%) of serotonin (S2) receptor density after 4 weeks or 10 weeks of daily injection in the rat. Loxapine (5 mg/kg) does not change dopamine receptor density but greatly reduces serotonin receptor density by 47% in the brain of rats .	False	CN1CCN(C2=Nc3ccccc3Oc3ccc(Cl)cc32)CC1
416257:01:03_10.00	19.0	99	416257	520746:01:02_50.00	520746	85.2	17.1	50.0	105	Emerione A		True	CC1=C[C@@]2(C)[C@@H](/C(C)=C/[C@]3(C)O[C@H](C)[C@@]4(C)O[C@H]43)[C@](C)([C@@H](O)[C@@H](C)C(=O)C(C)C)[C@H]2[C@]2(C)O[C@H]12
416257:01:03_10.00	19.0	99	416257	280962:01:03_30.00	280962	85.2	32.6	30.0	100	SB 218795	non-peptide NK3 tachykinin receptor antagonist.	False	COC(=O)[C@H](NC(=O)c1cc(-c2ccccc2)nc2ccccc12)c1ccccc1
416257:01:03_10.00	19.0	99	416257	407974:01:04_10.00	407974	84.89999999999999	19.2	10.0	97	GSK8814	it is a chemical probe for the ATAD2/2B bromodomain, with a binding constant pKd=8.1 as measured by ITC (Bamborough et al, 2016). GSK8814 displaces acetylated H4 peptide from the ATAD2 bromodomain with pIC50 =7.3 and is also active in BROMOscan with pKi=8.9. It is more than 100 fold selective over all other bromodomains in the BROMOscan. Importantly, it is more than 1000 fold selective over BRD4. GSK8814 shows cellular target engagement with an EC50 of 2 µM in a NanoBRET assay evaluating the interaction of the NanoLuc-ATAD2 bromodomain with histone H3.3-HaloTag.	True	CO[C@H]1CNC[C@@H](OCC2CCC(F)(F)CC2)[C@@H]1Nc1ncc(-c2cncc(C)c2)c2cc(C)c(=O)[nH]c12
416257:01:03_10.00	19.0	99	416257	528561:01:02_05.00	528561	84.6	25.2	5.0	103		JNJ-54119936 an inverse agonist of Retinoic Acid-Related Orphan Receptor RORC with Kd = 5.3 nM	True	COc1nc2ccc([C@@](O)(c3ccccc3)C3CCN(C(C)=O)CC3)cc2c(Cl)c1Cc1ccc(-n2cccn2)cc1
416257:01:03_10.00	19.0	99	416257	280076:01:03_30.00	280076	84.2	20.9	30.0	108	YM 976	phosphodiesterase type IV (PDE4) inhibitor. Exhibits anti-inflammatory activity without emesis.	False	CCc1ccc2c(-c3cccc(Cl)c3)nc(=O)n(CC)c2n1
416279:01:03_10.00	6.4	98	416279	413126:02:02_00.30	413126	82.5	37.5	0.3	98		negative control to BAY-293	True	CNCc1ccccc1-c1csc([C@H](C)Nc2nc(C)nc3cc(OC)c(OC)cc23)c1
416279:01:03_10.00	6.4	98	416279	281030:01:03_10.00	281030	81.6	32.8	10.0	91	U-74389G maleate	free radical lipid peroxidation inhibitor.	False	C[C@]12C=CC(=O)C=C1CC[C@@H]1C2=CC[C@]2(C)[C@@H](C(=O)CN3CCN(c4cc(N5CCCC5)nc(N5CCCC5)n4)CC3)CC[C@@H]12
416279:01:03_10.00	6.4	98	416279	247178:01:04_10.00	247178	81.0	18.1	10.0	94	Pirenperone, R-47,465	5-HT2 Serotonin receptor antagonist, 5-HT2 antagonist, 5ht2 receptor antagonist.	False	Cc1nc2ccccn2c(=O)c1CCN1CCC(C(=O)c2ccc(F)cc2)CC1
416279:01:03_10.00	6.4	98	416279	246509:01:04_10.00	246509	80.80000000000001	28.2	10.0	96	Methotrimeprazine maleat salt	Glutaminase kidney isoform, mitochondrial; Isocitrate dehydrogenase [NADP] cytoplasmic	False	COc1ccc2c(c1)N(C[C@H](C)CN(C)C)c1ccccc1S2
416279:01:03_10.00	6.4	98	416279	419170:01:05_10.00	419170	80.60000000000001	55.8	10.0	97	Hydroxychloroquine (free base)	Hydroxychloroquine is used to treat or prevent malaria; lysosomotropic.	False	CCN(CCO)CCCC(C)Nc1ccnc2cc(Cl)ccc12
416279:01:03_10.00	6.4	98	416279	413126:02:02_00.50	413126	80.60000000000001	53.9	0.5	106		negative control to BAY-293	True	CNCc1ccccc1-c1csc([C@H](C)Nc2nc(C)nc3cc(OC)c(OC)cc23)c1
416279:01:03_10.00	6.4	98	416279	246817:01:04_10.00	246817	80.5	45.4	10.0	106	Azithromycin	RNA translation inhibition, antibacterial.	False	CC[C@H]1OC(=O)[C@H](C)[C@@H](O[C@H]2C[C@@](C)(OC)[C@@H](O)[C@H](C)O2)[C@H](C)[C@@H](O[C@@H]2O[C@H](C)C[C@H](N(C)C)[C@H]2O)[C@](C)(O)C[C@@H](C)CN(C)[C@H](C)[C@@H](O)[C@]1(C)O
416279:01:03_10.00	6.4	98	416279	247361:01:04_10.00	247361	80.4	18.5	10.0	110	Promethazine hydrochloride	H1 Histamine receptor antagonist, anticholinergic, antihistaminic.	False	CC(CN1c2ccccc2Sc2ccccc21)N(C)C
416279:01:03_10.00	6.4	98	416279	419170:01:02_10.00	419170	80.2	64.1	10.0	92	Hydroxychloroquine (free base)	Hydroxychloroquine is used to treat or prevent malaria; lysosomotropic.	False	CCN(CCO)CCCC(C)Nc1ccnc2cc(Cl)ccc12
416279:01:03_10.00	6.4	98	416279	413110:01:04_30.00	413110	80.10000000000001	17.6	30.0	91	Ibutilide (fumarate)	Ibutilide fumarate is a Class III antiarrhythmic agent that is indicated for acute cardioconversion of atrial fibrillation and atrial flutter of a recent onset to sinus rhythm.Target: Calcium ChannelIbutilide fumarate is the first &#x27;pure&#x27; class III antiarrhythmic drug to become available. Its predominant action is prolongation of the myocardial action potential duration. Intravenous ibutilide 0.01 to 0.025 mg/kg or 1 to 2 mg successfully converted atrial flutter or fibrillation to sinus rhythm in 33 to 49% of patients in 2 placebo-controlled trials involving 439 patients with sustained arrhythmia . Ibutilide fumarate appears to be an effective alternative method for rapid conversion of recent-onset AF or AFl. The drug may be particularly useful in patients who have undergone recent cardiac surgery or those who are not ideal candidates for DCC .	False	CCCCCCCN(CC)CCCC(O)c1ccc(NS(C)(=O)=O)cc1
416310:01:03_10.00	16.9	107	416310	523782:02:04_03.00	523782	86.2	18.1	3.0	95	TTP-8307	TTP-8307 is a potent inhibitor of the replication of several rhino- and enteroviruses. TTP-8307 inhibits coxsackievirus B3 (CVB3; EC50=1.2 uM) and poliovirus by interfering with the synthesis of viral RNA. TTP-8307 exerts antiviral activity through oxysterol-binding protein (OSBP).	True	C[C@@H](NC(=O)c1cccc(-c2c[nH]c(-c3cc4ccccc4cn3)n2)c1)c1ccc(F)cc1
416310:01:03_10.00	16.9	107	416310	246448:01:04_30.00	246448	85.3	32.5	30.0	93	Clebopride maleate	Inhibition of Dopamine D2 receptor (IC50 = 17 nM); Inhibition of human ERG ( IC50 = 602.56 nM 6.22); Inhibiton of Acetylcholinesterase (IC50 = 890 nM)	False	COc1cc(N)c(Cl)cc1C(=O)NC1CCN(Cc2ccccc2)CC1
416310:01:03_10.00	16.9	107	416310	246866:02:03_10.00	246866	83.2	27.8	10.0	94	Cilnidipine	slow-acting Ca2+ channel blocker, antihypertensive, vasodilator. Does not inhibit PKC.	False	COCCOC(=O)C1=C(C)NC(C)=C(C(=O)OC/C=C/c2ccccc2)C1c1cccc([N+](=O)[O-])c1
416310:01:03_10.00	16.9	107	416310	246632:01:04_30.00	246632	83.1	25.6	30.0	95	Pronethalol hydrochloride	adrenergic receptor antagonist.	False	CC(C)NCC(O)c1ccc2ccccc2c1
416310:01:03_10.00	16.9	107	416310	281051:01:03_30.00	281051	83.0	39.2	30.0	94	Zimelidine dihydrochloride	serotonin reuptake inhibitor, antidepressant.	False	CN(C)C/C=C(/c1ccc(Br)cc1)c1cccnc1
416310:01:03_10.00	16.9	107	416310	280016:01:03_30.00	280016	82.8	40.6	30.0	97	LY-53,857 maleate	potent and selective 5-HT2 serotonin receptor antagonist.	False	CC(O)C(C)OC(=O)[C@@H]1C[C@@H]2c3cccc4c3c(cn4C(C)C)C[C@H]2N(C)C1
416310:01:03_10.00	16.9	107	416310	409878:01:04_50.00	409878	82.3	56.0	50.0	98	OF-1	OF-1 is a potent pan-BRPF bromodomain (BRD) inhibitor, with IC50 values of 270 nM, 1.2 uM for TRIM24 and BRPF1B, respectively.	False	COc1cc2c(cc1NS(=O)(=O)c1ccc(Br)cc1C)n(C)c(=O)n2C
416310:01:03_10.00	16.9	107	416310	246815:01:12_03.00	246815	82.19999999999999	16.2	3.0	95	Aripiprazole	antipsychotic, 5ht2a antagonist.	False	O=C1CCc2ccc(OCCCCN3CCN(c4cccc(Cl)c4Cl)CC3)cc2N1
416310:01:03_10.00	16.9	107	416310	410043:01:05_00.20	410043	82.19999999999999	23.1	0.2	95	XMD17-109	XMD17-109 is a novel, specific ERK-5 inhibitor, with an IC50 of 162 nM.	False	CCOc1cc(C(=O)N2CCC(N3CCN(C)CC3)CC2)ccc1Nc1ncc2c(n1)N(C1CCCC1)c1ccccc1C(=O)N2C
416310:01:03_10.00	16.9	107	416310	246859:01:04_30.00	246859	82.0	34.2	30.0	108	Vardenafil	PDE5 inhibitor.	False	CCCc1nc(C)c2c(=O)nc(-c3cc(S(=O)(=O)N4CCN(CC)CC4)ccc3OCC)[nH]n12
416320:01:03_10.00	13.1	92	416320	246498:01:04_30.00	246498	83.39999999999999	30.2	30.0	79	Mometasone furoate	Anti-inflammatory potency	False	C[C@@H]1C[C@H]2[C@@H]3CCC4=CC(=O)C=C[C@]4(C)[C@@]3(Cl)[C@@H](O)C[C@]2(C)[C@@]1(OC(=O)c1ccco1)C(=O)CCl
